,ticker,timestamp,headline,summary
2189,NVDA,2018-10-15T13:39:24Z,NVIDIA Option Alert: Fri $235 Puts Sweep (38) below Bid!: 1649 @ $2.846 vs 3277 OI; Earnings 11/8 After Close [est] Ref=$243.9,
2190,NVDA,2018-10-10T10:19:35Z,Volvo Selects AI-Based NVIDIA DRIVE Computer For Production Cars,
2191,NVDA,2018-10-10T10:04:01Z,IBM And NVIDIA Collaborate To Expand Open Source Machine Learning Tools For Data Scientists,
2192,NVDA,2018-10-09T15:48:55Z,Investor Movement Index September Summary,
2193,NVDA,2018-10-05T20:00:54Z,Rambus Renews Patent License With NVIDIA,
2194,NVDA,2018-10-05T20:00:52Z,Rambus Wins Patent License Renewal With NVIDIA,
2195,NVDA,2018-10-05T15:10:32Z,Trading Journal: Look For Near-Term Weakness In Nvidia,
2196,NVDA,2018-10-03T16:59:27Z,"Stocks Which Set New 52-Week High Yesterday, October 2nd",
2197,NVDA,2018-10-03T15:22:14Z,AMD's Stock Off To Rough October Start Following Best Quarter In Decades,
2198,NVDA,2018-10-02T13:20:35Z,"Stocks Which Set New 52-Week High Yesterday, October 1st",
2199,NVDA,2018-10-01T18:22:19Z,"Goldman Selective On Semis: Bullish On Nvidia, Xilinx, Bearish On Intel, Texas Instruments",
2200,NVDA,2018-10-01T13:30:02Z,"Barclays Downgrades Intel, Says Chipmaker Faces 'Costly Battle' With AMD For Market Share",
2201,NVDA,2018-09-28T18:14:34Z,Intel Adding $1B To CapEx To Boost Production,
2202,NVDA,2018-09-28T15:11:28Z,Watching shares of AMD and NVIDIA after Intel announced it plans to add $1B to capex in order to boost production,
2203,NVDA,2018-09-28T10:35:09Z,NVIDIA Shares Up ~2% On ~16K Shares In Pre-Market Action; Hearing Evercore ISI Analyst Raised Price Target To $400,
2204,NVDA,2018-09-27T17:28:04Z,'Cutting Edge' Collaborative Intelligence Startup Algo.ai Joins Nvidia Inception Accelerator,
2205,NVDA,2018-09-25T15:16:32Z,"KeyBanc Starts Coverage On 10 Semiconductor Stocks, Downgrades Cypress Semi",
2206,NVDA,2018-09-25T14:30:43Z,"BofA Raises Nvidia Price Target To A Street High, Sees Upside In Multiple Segments",
2207,NVDA,2018-09-25T13:11:03Z,"Benzinga's Top Upgrades, Downgrades For September 25, 2018",
2208,NVDA,2018-09-25T10:20:23Z,KeyBanc Initiates Coverage On NVIDIA with Sector Weight Rating,
2209,NVDA,2018-09-24T17:55:33Z,Bank Of America: Don't Sweat Mixed Nvidia Turing Reviews,
2210,NVDA,2018-09-20T18:43:11Z,Still-Bullish Morgan Stanley Tamps Down Expectations For Nvidia's Turing GPUs,
2211,NVDA,2018-09-14T11:06:52Z,"NVIDIA Shares Indicated Up 1.4% Premarket On Light Volume (~11.5K Shares); Hearing Needham Raised Price Target On Stock To $350, Cited 'increased confidence  NVDA will begin to take a larger share of the inference market...'",
2212,NVDA,2018-09-13T08:38:28Z,NVIDIA Launches AI Data Center Platform,
2213,NVDA,2018-09-11T19:28:56Z,AMD's Setup Gives Rosenblatt Securities Deja Vu,
2214,NVDA,2018-09-11T15:53:48Z,A Chip ETF Bleeds Cash; Some Of It May Be Going Here,
2215,NVDA,2018-09-10T16:51:38Z,"BofA: Latest Steam Gaming Data Good News For Nvidia, AMD",
2216,NVDA,2018-09-05T17:02:59Z,Watching NVIDIA Shares Amid Report Huawei Doing An AI Chip Deal With Microsoft In China,
2217,NVDA,2018-09-05T14:22:44Z,"Stocks Which Set New 52-Week High Yesterday, September 4th",
2218,NVDA,2018-08-31T14:11:57Z,"Stocks Which Set New 52-Week High Yesterday, August 30th",
2219,NVDA,2018-08-30T19:08:54Z,"Stocks That Made New 52-Week Highs Today Include: FLIR Systems, Textron, Darden Restaurants, United Continental, Intuitive Surgical, TJX, NetApp, Illumina, First Energy, NVIDIA, Microsoft, Visa, and Paypal",
2220,NVDA,2018-08-30T15:47:13Z,"Stocks Which Set New 52-Week High Yesterday, August 29th",
2221,NVDA,2018-08-29T13:59:24Z,Solid Extra-Base Hit From GDP Breaks Up Otherwise Dull Week On Street,
2222,NVDA,2018-08-27T13:24:02Z,"Stocks Which Set New 52-Week High Friday, August 24th",
2223,NVDA,2018-08-25T21:33:08Z,"Benzinga's Bulls & Bears Of The Week: Alibaba, Apple, Nike, Tesla, Verizon And More",
2224,NVDA,2018-08-24T15:22:12Z,The Hot Chips 2018 Conference: Morgan Stanley's Takeaways,
2225,NVDA,2018-08-24T13:11:18Z,"Stocks Which Set New 52-Week High Yesterday, August 23rd",
2226,NVDA,2018-08-23T21:02:07Z,Have You Tried The New Benzinga Pro Chat Beta Yet? We Often Discuss Hot Stocks And The Recent Breaking News Items Over The Last Few Mins.; Check It Out At https://pro.benzinga.com/popout/widget/chat/,
2227,NVDA,2018-08-23T16:04:52Z,Rosenblatt Says AMD Now Has A Path To $30 Per Share,
2228,NVDA,2018-08-23T14:07:50Z,"Fed On Center Stage As Jackson Hole Meeting Starts, With Powell Speech Friday",
2229,NVDA,2018-08-22T21:48:42Z,NVIDIA Shares Unaffected After Hours As Citron's Andrew Left Is Currently On CNBC Discussing His Short Thesis In The Stock,
2230,NVDA,2018-08-22T20:14:26Z,Infographic: PC Gamers Prefer Nvidia GPUs,
2231,NVDA,2018-08-22T18:00:04Z,Netflix Vs. Amazon Vs. Nvidia: Picking A Tech Stock For The Long Haul,
2232,NVDA,2018-08-21T21:14:19Z,"Benzinga Pro's Top 10 Most-Searched Tickers For Afternoon Of Tues., Aug. 21, 2018",
2233,NVDA,2018-08-21T16:32:48Z,'I have been a consistent backer of Nvidia. I understood there would be a short raid on it and i was right. No  one has been as stalwart as i have been. Join the Club... '-Jim Cramer Tweets,
2234,NVDA,2018-08-21T15:53:42Z,"Munster Sees 'Holy Grail' In Nvidia's New GPUs, While Stifel Takes Neutral Stance On Chipmaker",
2235,NVDA,2018-08-21T15:48:22Z,"' This is not a short talking- this is Ebay,  Don't mess with Google.'-Citron Research Tweets (2/2)",
2236,NVDA,2018-08-21T15:47:51Z,'Citron knows investors don't read full reports  So here is the one takeaway to focus on why $NVDA going to $200.  Customers are moving away from GPU to TPU as they find it faster and cheaper.'-Citron Research Tweets (1/2),
2237,NVDA,2018-08-21T14:25:58Z,NVIDIA Shares Fall ~0.5% From Session High Following Tweet From Citron Research Suggesting Stock Is 'On Its Way To $200'; Shares Up 1.4% For Session,
2238,NVDA,2018-08-21T14:23:30Z,'$NVDA on its way to $200.  With short interest at an all time low and datacenter facing major competition not even ray tracing can support these lofty levels' -Tweet From Citron,
2239,NVDA,2018-08-21T13:32:14Z,"Benzinga Pro's Top 10 Most-Searched Tickers For Morning Of Tues., Aug. 21, 2018",
2240,NVDA,2018-08-20T19:21:26Z,Nvidia Unveils GeForce RTX Series: 'A New Golden Age Of Gaming',
2241,NVDA,2018-08-20T18:55:08Z,NVIDIA shares are trading up 2.4% following company updates on RTX 2000 series gaming chips,
2242,NVDA,2018-08-20T18:07:07Z,From Gamescom 2018 Conference: NVIDIA Corp RTX 2000 Series Gaming Chips Will Range From $499 To $999 And Will Be Available Starting Sept. 20,
2243,NVDA,2018-08-20T17:59:06Z,"PR Confirms Earlier Gamescom News, NVIDIA RTX Platform Brings Real-Time Ray Tracing and AI to Barrage of Blockbuster Games",
2244,NVDA,2018-08-20T17:11:05Z,"NVIDIA CEO Jensen Huang Giving Latest Updates From The Company's GeForce Pre-Gamescom Event, Live On YouTube",
2245,NVDA,2018-08-20T17:02:38Z,NVIDIA CEO At Gamescom Says Newest Gaming Chips Will Use AI To Improve Computer Graphics,
2246,NVDA,2018-08-20T11:19:19Z,REMINDER: NVIDIA Could Launch Its RTX 2080 Ti and RTX 2080 GPU as Early as Today,
2247,NVDA,2018-08-20T09:33:02Z,50 Biggest Movers From Friday,
2248,NVDA,2018-08-19T15:55:50Z,"Benzinga's Bulls & Bears Of The Week: Facebook, Netflix, Twitter, Walmart And More",
2249,NVDA,2018-08-18T13:29:29Z,What Wall Street Thinks Of Nvidia's Q2 Earnings,
2250,NVDA,2018-08-17T16:22:13Z,41 Stocks Moving In Friday's Mid-Day Session,
2251,NVDA,2018-08-17T14:48:18Z,"Benzinga Pro's Top 10 Most-Searched Tickers For the Morning of Friday, Aug. 17th",
2252,NVDA,2018-08-17T14:32:31Z,Oppenheimer Upgrades Nvidia: 'We See Continued Outsized Growth',
2253,NVDA,2018-08-17T14:07:27Z,10 Biggest Price Target Changes For Friday,
2254,NVDA,2018-08-17T14:06:11Z,Headlights On Deere: Mixed Results As Company Cites Higher Costs,
2255,NVDA,2018-08-17T12:59:04Z,"Benzinga's Top Upgrades, Downgrades For August 17, 2018",
2256,NVDA,2018-08-17T12:57:00Z,Morgan Stanley Sees Buying Opportunity In Nvidia: 'Clarity Likely After Next Week's Product Launches',
2257,NVDA,2018-08-17T12:02:36Z,23 Stocks Moving In Friday's Pre-Market Session,
2258,NVDA,2018-08-17T11:41:08Z,"Cisco, Macy's, Nvidia, TLT: 'Fast Money' Picks For August 17",
2259,NVDA,2018-08-17T11:27:01Z,Oppenheimer Upgrades NVIDIA to Outperform,
2260,NVDA,2018-08-17T11:09:26Z,"Stifel Nicolaus Maintains Hold on NVIDIA, Raises Price Target to $250",
2261,NVDA,2018-08-17T10:46:28Z,A Peek Into The Markets: US Stock Futures Edge Lower Ahead Of Economic Data,
2262,NVDA,2018-08-17T09:28:21Z,"7 Stocks To Watch For August 17, 2018",
2263,NVDA,2018-08-16T20:27:49Z,"From NVIDIA's Q2 CFO Commentary, Co. Says It Previously Anticipated Crypto to Be 'Meaningful for the year, we are now projecting no contributions going forward.'",
2264,NVDA,2018-08-16T20:26:39Z,"From NVIDIA's Q2 CFO Commentary, Co. Says GPU Sales Up 40% YoY, Down 4% Sequentially; Adds Co. Had Anticipated Crypto-product Sales Declining To ~$100M, But Actual Crypto Sales Were Only $18M",
2265,NVDA,2018-08-16T20:25:34Z,NVIDIA shares are trading down 5% after hours as weak Q3 sales guidance appears to offset Q2 earnings beat.,
2266,NVDA,2018-08-16T20:20:57Z,NVIDIA Sees Q3 Sales $3.185B-$3.315B vs $3.34B Est.,
2267,NVDA,2018-08-16T20:20:39Z,"NVIDIA Q2 Adj. EPS $1.94 Beats $1.66 Estimate, Sales $3.12B Beat $3.11B Estimate",
2268,NVDA,2018-08-16T19:54:16Z,NVIDIA Q2 Earnings Due Out After The Close Today; Co. Historically Issues Its Report ~4:20pm ET,
2269,NVDA,2018-08-16T15:28:21Z,Benzinga Pro's 5 Stocks To Watch Today,
2270,NVDA,2018-08-16T14:24:51Z,"Care Package: Walmart Results, China Trade Talks Might Help Lift Spirits",
2271,NVDA,2018-08-16T09:10:11Z,"10 Stocks To Watch For August 16, 2018",
2272,NVDA,2018-08-16T08:17:44Z,"Earnings Scheduled For August 16, 2018",
2273,NVDA,2018-08-15T17:22:24Z,Nvidia Gets Double Upgrade Ahead Of Earnings,
2274,NVDA,2018-08-15T15:44:56Z,Upcoming Earnings: Tech Giant Nvidia Unveils New GPUs Ahead Of Q2 Results,
2275,NVDA,2018-08-15T15:31:49Z,"13F From David Tepper's Appaloosa Late Tuesday Showed Exited Stake In Applied Materials, NVIDIA;  New 219.272K Share Stake In NXP Semiconductors",
2276,NVDA,2018-08-15T14:23:13Z,"Q2 13F Roundup: How Buffett, Einhorn, Loeb And Others Adjusted Their Portfolio",
2277,NVDA,2018-08-15T13:49:20Z,10 Biggest Price Target Changes For Wednesday,
2278,NVDA,2018-08-15T13:10:32Z,"Benzinga's Top Upgrades, Downgrades For August 15, 2018",
2279,NVDA,2018-08-15T11:20:08Z,"Wells Fargo Upgrades NVIDIA to Outperform, Raises Price Target to $315",
2280,NVDA,2018-08-15T00:51:03Z,Nvidia Shares Rise 0.8% After-Hours Following Wells Fargo Upgrade to Outperform,
2281,NVDA,2018-08-14T21:13:05Z,"13F From Soros Fund Shows Exited Stake In Fiat Chrysler, Exited Stake In NVIDIA; Reduced Stake In JP Morgan, Netflix; Raised Stake In Lululemon",
2282,NVDA,2018-08-14T19:26:24Z,What To Expect From Nvidia's Q2 Earnings,
2283,NVDA,2018-08-13T17:26:39Z,"The Week Ahead: Nvidia, Retailer Earnings In Focus",
2284,NVDA,2018-08-10T15:25:34Z,"Goldman's Chipmaker Pair Trade: Sell Intel, Not AMD",
2285,NVDA,2018-08-08T16:02:52Z,"Nvidia's Q2 Likely To Be 'Noisy,' But Goldman Sachs Remains Bullish",
2286,NVDA,2018-08-03T12:47:48Z,"Semiconductor, Memory Related Stocks Appear Largely Unaffected Following Report China's Ministry Of Commerce Has Said Semiconductors Will Be One Group Targeted By New Proposed Tariffs On US",
2287,NVDA,2018-08-02T13:45:18Z,NVIDIA Shares Rebound 1.5% From Session Low At Open But Still Down ~0.7% For Session; CNBC Recently Published 'Elon Musk says Tesla A.I. chip project is 'finally coming to fruition'',
2288,NVDA,2018-08-01T18:18:52Z,Upcoming Earnings: MGM And Activision Blizzard Report Q2 Results On Thursday,
2289,NVDA,2018-07-31T15:44:35Z,"Tesla Earnings: Model 3 Production Target Hit, What's Next?",
2290,NVDA,2018-07-30T21:25:51Z,"Watching Self-Driving Fleet Players, Uber Partners For Self-Driving Truck Segment Amid Earlier Report Uber To Stop Development Of Self-Driving Trucks, Will Only Proceed With Cars",
2291,NVDA,2018-07-29T21:29:53Z,"Barron's Picks And Pans: Amazon, Eli Lilly, Fiat Chrysler And More",
2292,NVDA,2018-07-26T15:08:32Z,Slew Of Semiconductor Earnings Could Elevate This ETF,
2293,NVDA,2018-07-26T13:49:43Z,"Google Releases Its ASIC AI Infrastructure Called Edge TPU, Watch Shares of NVIDIA On This News",
2294,NVDA,2018-07-23T15:28:23Z,TechRadar Reports 'Nvidia GeForce GTX 1180 rumored again to release in August',
2295,NVDA,2018-07-22T21:24:11Z,"Benzinga's Bulls & Bears Of The Week: AbbVie, Netflix, Philip Morris, Wells Fargo And More",
2296,NVDA,2018-07-19T21:02:15Z,NVIDIA To Report Q2 Results August 16th At 4:20pm ET,
2297,NVDA,2018-07-19T11:46:56Z,"European Union Antitrust Regulators Charge Qualcomm With New Violation In Case Related To NVIDIA Unit, ICERA",
2298,NVDA,2018-07-17T14:40:22Z,"Morgan Stanley: Nvidia 'The Cleanest Growth Story In Semis,' With New Products Ahead",
2299,NVDA,2018-07-13T19:51:41Z,"Bluefin Research Talks Trade War Impact On Nvidia, AMD",
2300,NVDA,2018-07-13T13:58:50Z,"NVIDIA Shares Fall Off The Open, Down 1.34% As Traders Circulate A Mixed Bluefin Note From July 12th; Bluefin Says That While Crypto Demand Is Weak And Graphics Card Sales Are Sluggish, They Believe Data Center Momentum Will Be A Near-Term Primary Driver",
2301,NVDA,2018-07-12T17:25:33Z,NVIDIA Shares Trading Lower As Traders Circulate The Information Article Which Highlights Huawei's AI Push With 'Project Da Vinci' To Challenge NVIDIA's AI Chips,
2302,NVDA,2018-07-09T19:36:35Z,Forecasting Software: Nvidia Looks Primed For More Upside,
2303,NVDA,2018-07-05T15:23:05Z,The Semiconductor Stocks That Fund Managers Love And Hate,
2304,NVDA,2018-07-02T18:35:18Z,Tech Sector Earnings: What's Been Going on Ahead Of Q2 Reports?,
2305,NVDA,2018-07-02T13:39:30Z,NVIDIA Option Alert: Jul 20 $220 Puts Sweep (51) below Bid!: 1725 @ $2.601 vs 5202 OI; Earnings 8/9 After Close [est] Ref=$236.12,
2306,NVDA,2018-06-28T16:12:01Z,Trade Spat's A Boon For This Bearish Chip ETF,
2307,NVDA,2018-06-27T16:54:38Z,Analyst Says Nvidia's Second-Half Outlook Is Promising,
2308,NVDA,2018-06-26T14:27:40Z,Trade Worries Still Weigh On Market A Day After Rout,
2309,NVDA,2018-06-26T13:20:22Z,"FBN Securities Initiates Coverage On NVIDIA with Outperform Rating, Announces $300 Price Target",
2310,NVDA,2018-06-26T13:06:14Z,"Benzinga's Top Upgrades, Downgrades For June 26, 2018",
2311,NVDA,2018-06-26T11:08:48Z,"Benchmark Initiates Coverage On NVIDIA with Buy Rating, Announces $280 Price Target",
2312,NVDA,2018-06-25T15:00:43Z,Bank Of America Raises AMD Target On Market Share Optimism,
2313,NVDA,2018-06-19T15:54:43Z,A Look Back At What's Happened To Each Sector Through The First Half Of 2018 (Part 1),
2314,NVDA,2018-06-18T21:17:42Z,S&P Dow Jones Indices Announces 'NVIDIA Set to Join S&P 100; FleetCor Technologies to Join S&P 500; Penn Virginia to Join S&P SmallCap 600',
2315,NVDA,2018-06-14T19:51:31Z,"Stocks That Made New 52 Week Highs Today Include: Zoetis, Fortive, VeriSign, CF Industries, Ansys, Facebook, IDEXX, Fiserv, Global Payments, CA, Akamai, AES, NVIDIA, Align Tech, and Adobe",
2316,NVDA,2018-06-14T13:54:03Z,"What The Latest Steam Gaming Data Means For AMD, Nvidia",
2317,NVDA,2018-06-13T18:03:24Z,A New Automation ETF For Traders Who Haven't Yet Been Replaced By Robots,
2318,NVDA,2018-06-12T14:38:34Z,BofA Highlights The Most 'Underowned' Semi Stocks,
2319,NVDA,2018-06-07T17:05:07Z,Form 4 Filing Late Wednesday Showed NVIDIA Director Brooke Seawell Sold a Total of 21.029K Shares at Avg. Prices Ranging From $264.63 TO $264.85,
2320,NVDA,2018-06-06T14:28:12Z,"BlueFin Research: Graphics Card Market For AMD, Nvidia Continues To Cool In Q2",
2321,NVDA,2018-06-06T13:53:10Z,Three Industries Already Using Self-Driving Vehicles,
2322,NVDA,2018-06-04T20:47:48Z,"Stocks That Made New 52-Week Highs Today: Salesforce, Microchip, Fiserv, Edwards Lifesciences, Nike, Stryker, Align Tech, NVIDIA, Visa, IDEXX Labs, Ralph Lauren, Extra Space Storage, Kohl's, Macy's, Marathon Petroleum, Baxter, Expeditors Int'l & TransDigm",
2323,NVDA,2018-06-04T08:20:58Z,"NVIDIA, Taiwan's MOST Announce Collaboration to Supercharge AI Efforts",
2324,NVDA,2018-06-04T08:14:06Z,NVIDIA Launches NVIDIA Isaac Platform to Power Next-gen Autonomous Machines,
2325,NVDA,2018-05-31T13:35:47Z,Encouraging Data For Electric Vehicle ETFs,
2326,NVDA,2018-05-30T08:00:07Z,NVIDIA Introduces First Unified Computing Platform for Both AI and High Performance Computing,
2327,NVDA,2018-05-22T08:17:30Z,"Nvdia, AMD May See 2018 Profits Fall as Crypto Mining Craze Fades",
2328,NVDA,2018-05-21T21:42:23Z,"Benzinga Pro's Top 10 Most-Searched Tickers For Evening Of Mon., May 21, 2018",
2329,NVDA,2018-05-20T18:34:47Z,"Benzinga's Bulls & Bears Of The Week: Coca-Cola, Ford, JC Penney, Spotify And More",
2330,NVDA,2018-05-18T16:05:18Z,Cowen Models 30% Upside In Nvidia,
2331,NVDA,2018-05-17T21:56:13Z,"Cowen Names 4 Top Semi Picks: AMD, Ambarella, Broadcom, Monolithic Power",
2332,NVDA,2018-05-17T20:37:29Z,"Cowen & Co. Initiates Coverage On NVIDIA with Outperform Rating, Announces $325 Price Target",
2333,NVDA,2018-05-17T20:16:57Z,"NVIDIA Shares Volatile After Hours, Hearing Cowen Initiated Coverage With Outperform Rating, $325 Price Target",
2334,NVDA,2018-05-16T17:55:38Z,"Global X Launches AI, Big Data ETF",
2335,NVDA,2018-05-16T15:38:50Z,"Q1 13F Roundup: How Buffett, Einhorn, Ackman And Others Adjusted Their Portfolio",
2336,NVDA,2018-05-15T20:41:17Z,13F From David Tepper's Appaloosa Shows New 150K Share Stake In NVIDIA,
2337,NVDA,2018-05-14T18:09:52Z,"Benzinga Pro's Top 10 Most-Searched Tickers For Afternoon Of Mon., May 14",
2338,NVDA,2018-05-11T19:44:09Z,"UBS Maintains Neutral on NVIDIA, Raises Price Target to $266",
2339,NVDA,2018-05-11T19:10:07Z,"B. Riley FBR Maintains Buy on NVIDIA, Raises Price Target to $300",
2340,NVDA,2018-05-11T18:40:58Z,"Barclays Maintains Overweight on NVIDIA, Raises Price Target to $300",
2341,NVDA,2018-05-11T18:31:56Z,Mid-Afternoon Market Update: MoSys Climbs Following Q1 Results; Obalon Therapeutics Shares Slide,
2342,NVDA,2018-05-11T17:19:00Z,Wall Street Reacts To Nvidia's Quarter,
2343,NVDA,2018-05-11T16:45:35Z,A BUZ-Worthy ETF,
2344,NVDA,2018-05-11T16:07:48Z,Mid-Day Market Update: Trade Desk Surges on Upbeat Earnings; Stellar Biotechnologies Shares Drop,
2345,NVDA,2018-05-11T15:23:36Z,Morgan Stanley Lifts Nvidia Price Target After Strong Q1,
2346,NVDA,2018-05-11T15:01:58Z,Can Market Draw a Seven? DJIA Up Six Straight Days Amid Tech Rally,
2347,NVDA,2018-05-11T14:15:14Z,Mid-Morning Market Update: Markets Open Higher; NVIDIA Earnings Top Expectations,
2348,NVDA,2018-05-11T13:55:07Z,5 Biggest Price Target Changes For Friday,
2349,NVDA,2018-05-11T13:19:15Z,KeyBanc's Takeaways From Nvidia's Q1 Report,
2350,NVDA,2018-05-11T11:29:26Z,"A Peek Into The Markets: U.S. Stock Futures Rise Ahead Of Import Prices, Consumer Sentiment Data",
2351,NVDA,2018-05-11T08:04:41Z,"6 Stocks To Watch For May 11, 2018",
2352,NVDA,2018-05-10T21:38:28Z,NVIDIA CFO On Conf. Call Reportedly Says Supply Situation Is 'Now Easing' And GPU Channel Prices Normalizing,
2353,NVDA,2018-05-10T21:15:54Z,"From NVIDIA Q1 Earnings Conference Call: CFO Says Co.'s Supply Situation Is 'Easing,' Channel Prices For GPUs Normalizing",
2354,NVDA,2018-05-10T20:49:50Z,"Nvidia Blows Out Q1 Estimates, Raises Q2 Sales Guidance",
2355,NVDA,2018-05-10T20:21:37Z,UPDATE: NVIDIA Sees Q2 Adj. Gross Margins 63.5% +/- 50 Basis Points,
2356,NVDA,2018-05-10T20:21:18Z,"NVIDIA Shares Initially Move Lower, Now Spiking Higher To $263.50 High, Now Down 0.6%",
2357,NVDA,2018-05-10T20:20:53Z,NVIDIA Sees Q2 Sales $3.1B vs $2.95B Est.,
2358,NVDA,2018-05-10T20:20:19Z,"NVIDIA Q1 EPS $2.05 Beats $1.45 Estimate, Sales $3.21B Beat $2.89B Estimate",
2359,NVDA,2018-05-10T19:31:16Z,"NVIDIA Shares At Intraday Highs 30 Mins. Ahead Of Q1 Earnings, Touch High At $260.00, Up 1.6% For Session",
2360,NVDA,2018-05-10T16:19:27Z,"Benzinga Pro's Top 10 Most-Searched Tickers For Afternoon Of Thurs., May 10, 2018",
2361,NVDA,2018-05-10T15:43:15Z,"Cryptocurrency Mining Grew Faster Than Expected, Bernstein Says In Semiconductor Roundup",
2362,NVDA,2018-05-10T14:17:13Z,"As Oil Fuels Equities Rally, Markets Eyeing Key Technical Levels",
2363,NVDA,2018-05-10T13:21:53Z,Benzinga Pro's 5 Stocks To Watch Today,
2364,NVDA,2018-05-10T09:16:18Z,"11 Stocks To Watch For May 10, 2018",
2365,NVDA,2018-05-10T08:00:46Z,"Earnings Scheduled For May 10, 2018",
2366,NVDA,2018-05-09T14:13:36Z,Upcoming Earnings: Nvidia Reports After Thursday's Close,
2367,NVDA,2018-05-09T10:49:15Z,'NYTimes.com blames crypto miners for shortages of my chips but that is so yesterday's news. This quarter will show a big drop off in crypto sales. Everyone knows that. At least I thought they did. Nvidia',
2368,NVDA,2018-05-08T18:09:52Z,NVIDIA Shares Largely Unaffected Following Citron Tweet 'Not a story of shorts vs $NVDA it is $NVDA vs $GOOG...Shorting into earnings.',
2369,NVDA,2018-05-08T13:56:32Z,"With Trump Iran Announcement In Focus, US Stock Futures Fall",
2370,NVDA,2018-05-08T13:37:05Z,8 Biggest Price Target Changes For Tuesday,
2371,NVDA,2018-05-08T12:19:25Z,"Deutsche Bank Maintains Hold on NVIDIA, Raises Price Target to $240",
2372,NVDA,2018-05-08T11:33:43Z,"Amgen, Halliburton, Nvidia, Gold: 'Fast Money' Picks For May 8",
2373,NVDA,2018-05-07T14:20:11Z,"Benzinga Pro's Top 10 Most-Searched Tickers For Morning Of Mon., May 7",
2374,NVDA,2018-05-07T12:01:19Z,"The Week Ahead: Nvidia And Dropbox Earnings, April Retail Sales, Trump Drug Pricing Speech Expected",
2375,NVDA,2018-05-06T21:49:55Z,"Benzinga's Bulls & Bears Of The Week: Apple, Alibaba, Spotify, 3M And More",
2376,NVDA,2018-05-04T17:54:20Z,An ETF With A Futuristic View Of Transportation,
2377,NVDA,2018-05-04T15:28:19Z,Jobs Growth Stays A Little Slow in April As Unemployment Rate Falls,
2378,NVDA,2018-05-04T14:33:05Z,"Morgan Stanley Previews Semi Earnings, Expects Strong Nvidia Results Despite Crypto Concerns",
2379,NVDA,2018-05-03T16:29:28Z,Upcoming Earnings: Alibaba Reports Before Market Open On Friday,
2380,NVDA,2018-05-03T15:26:19Z,"Benzinga's Top Upgrades, Downgrades For May 3, 2018",
2381,NVDA,2018-05-03T14:43:31Z,"Barclays Upgrades Nvidia, Says AI Opportunity Is Too Big To Ignore",
2382,NVDA,2018-05-03T13:00:52Z,"The Market In 5 Minutes: Tesla Earnings, Under Armour's Future, GM, Nvidia, Square And More",
2383,NVDA,2018-05-03T10:35:56Z,"A Peek Into The Markets: U.S. Stock Futures Gain Ahead Of Earnings, Economic Data",
2384,NVDA,2018-05-03T10:20:11Z,Barclays Upgrades NVIDIA to Overweight,
2385,NVDA,2018-05-03T08:15:15Z,Barclays Upgrades Nvidia to Overweight from Equal Weight; Raises PT to $280 from $265,
2386,NVDA,2018-04-30T21:14:16Z,Playmakers: The Investor Picks From CNBC's 2018 Stock Draft,
2387,NVDA,2018-04-30T16:07:16Z,'Google brings Nvidia's Tesla V100 GPUs to its cloud',
2388,NVDA,2018-04-27T20:26:45Z,"Analysts Applaud Intel's Q1 Beat-And-Raise, Say Delay In 10-Nanometer Chips A Negative",
2389,NVDA,2018-04-27T15:14:44Z,Cramer Continues Warming Up To AMD After Listening To CEO,
2390,NVDA,2018-04-27T08:43:38Z,U.S. Government May Start Scrutinizing Informal Partnerships Between American and Chinese Companies in AI,
2391,NVDA,2018-04-25T15:57:22Z,'Taiwan graphic card makers to see shipments plunge 40% in April',
2392,NVDA,2018-04-23T19:33:54Z,Who Profits From The Incredible Success Of 'Fortnite'?,
2393,NVDA,2018-04-23T17:12:46Z,"'Palihapitiya: $NVDA and $GOOG are the two big players in compute AI tech. Much of the value has been seen, but still interesting from this POV. #Sohn2018'- MarketWatch's Ryan Vlastelica Tweet",
2394,NVDA,2018-04-22T21:02:22Z,Gene Munster: Four Reasons Why 'Fortnite' Has Won Over Gamers,
2395,NVDA,2018-04-21T20:51:51Z,"Barron's Picks And Pans: General Electric, General Mills, MLPs And More",
2396,NVDA,2018-04-20T20:13:08Z,Leverage Comes To The Robotics Trade,
2397,NVDA,2018-04-20T18:09:32Z,"Though Their Stocks Have Cooled, The Semiconductor Industry Is As Hot As Ever",
2398,NVDA,2018-04-19T21:00:49Z,NVIDIA Sets Conference Call for First-Quarter Financial Results For May 10th After Market Close,
2399,NVDA,2018-04-19T13:28:58Z,"Apple, Chips Stocks Falling Amid Taiwan Semiconductor's Weak Guidance",
2400,NVDA,2018-04-19T13:12:47Z,"Semi Stocks Lower On Weak Q1 Report, Q2 Guidance From Taiwan Semi: NVIDIA Shares Down 2%, Micron Down 1.8%, AMD, Applied Materials Down 1.7%, Texas Instruments Down 1.3%, Xilinx Down 1%",
2401,NVDA,2018-04-19T12:01:36Z,"CNBC Reports 'Apple, Nvidia shares fall after a key Asian chip partner gives weak guidance'; Taiwan Semiconductor Manufacturing Said Its Q2 Sales Guidance Is $7.8-$7.9B vs $8.8B Est.; Blames Weakness On Softening High-End Smartphone Demand, Crytpo Market",
2402,NVDA,2018-04-18T19:14:11Z,A Third Electric Vehicle ETF Charges Up,
2403,NVDA,2018-04-16T15:54:47Z,"'Partners: Intel's Rumored Plans To Take On Nvidia, AMD With Discrete GPU Good For The Channel'",
2404,NVDA,2018-04-16T15:35:21Z,Elazar Warns Crypto-NVIDIA Shorts,
2405,NVDA,2018-04-13T13:58:48Z,"'Citron accepting a challenge.  @jimcramer has famously named his dog Nvidia.  If $NVDA is trading over $230 in 12 months, Citron will donate $230k to the Humane Society...'",
2406,NVDA,2018-04-13T11:07:54Z,'Morons buying $NVDA on higher crypto. They do ethereum and it is 5% max.. So sell it please. Get off my dog.',
2407,NVDA,2018-04-11T18:05:35Z,Forget Crypto: eSports Might Be Where It's At For Nvidia And AMD,
2408,NVDA,2018-04-11T09:17:25Z,36 Biggest Movers From Yesterday,
2409,NVDA,2018-04-10T18:36:28Z,"Benzinga's Top Analyst Calls From April 10, 2018",
2410,NVDA,2018-04-10T16:40:10Z,25 Stocks Moving In Tuesday's Mid-Day Session,
2411,NVDA,2018-04-10T13:26:13Z,"Benzinga's Top Upgrades, Downgrades For April 10, 2018",
2412,NVDA,2018-04-10T12:26:31Z,Morgan Stanley Upgrades Nvidia As The Data Era Is Now 'Investable',
