,ticker,timestamp,headline,summary
571,NVDA,2021-08-23T21:49:09Z,"Why Former Veteran NYSE Floor Trader Bought Shares of NVIDIA, Alibaba and Facebook on Monday","Veteran trader David Green was back live trading on Benzinga Monday morning, and the long-time trader made some moves in some big-name stocks such as NVIDIA Corporation (NASDAQ: NVDA), Facebook Inc &lt;"
572,NVDA,2021-08-23T19:42:35Z,Why Nvidia Shares Are Rising Today,"Shares of semiconductor and chip stocks, including NVIDIA Corporation (NASDAQ: NVDA), are trading higher after Maxim&#39;s acquisition by Analog Devices was approved by Chinese anti-trust officials. Overall tech strength also helped lift the sector today as well."
573,NVDA,2021-08-23T17:11:49Z,10 Information Technology Stocks With Unusual Options Alerts In Today's Session, This unusual options alert can help traders discover the next big trading opportunities. Traders will search for circumstances when the market estimation of an option diverges heavily from its normal worth. Unusual trading activity could push option prices to exaggerated or underestimated levels. 
574,NVDA,2021-08-23T14:13:21Z,Jackson Hole Goes Virtual: Powell Speech On Friday Could Set Tone On Policy,"The fresh air of Wyoming beckons this week, but it will have to be from a distance as Fed Chairman Jerome Powell and company prepare for a virtual Jackson Hole symposium. "
575,NVDA,2021-08-23T14:07:42Z,Stocks That Hit 52-Week Highs On Monday," 

 

Before 10 a.m. ET on Monday, 119 companies hit new 52-week highs."
576,NVDA,2021-08-23T13:15:04Z,Why Are Maxim Integrated Shares Trading Higher Today?,"
"
577,NVDA,2021-08-23T10:53:48Z,"Pfizer, Alibaba, Nvidia, Moderna, Palantir — Stocks Buzzing On WallStreetBets Heading Into New Week","Heading into a new trading week, Pfizer Inc. (NYSE: PFE), Alibaba Group Holding Limited (NYSE: BABA), Nvidia Corp."
578,NVDA,2021-08-20T19:30:50Z,NVIDIA Option Alert: Sep 24 $225 Calls Sweep (19) near the Ask: 385 @ $3.451 vs 300 OI; Ref=$207.83,
579,NVDA,2021-08-20T18:10:35Z,"Nvidia Shares Continue Higher, Move Above $207 Level; Up 5% For Session",
580,NVDA,2021-08-20T16:56:08Z,10 Information Technology Stocks With Unusual Options Alerts In Today's Session,This unusual options alert can help traders discover the next big trading opportunities. Traders will search for circumstances when the market estimation of an option diverges heavily from its normal worth. Unusual trading activity could push option prices to exaggerated or underestimated levels. 
581,NVDA,2021-08-20T16:30:26Z,NVIDIA Option Alert: Aug 27 $215 Calls Sweep (19) near the Ask: 402 @ $0.921 vs 2270 OI; Ref=$204.1,
582,NVDA,2021-08-20T10:53:36Z,"Tesla Places Itself As A Robotics Company With Reach Beyond EVs, Unveils Dojo Chips, Humanoid: Key Takeaways From AI Day",Tesla Inc’s (NASDAQ: TSLA) held its highly-anticipated “AI Day” on Thursday that was covered in a live blog&lt;
583,NVDA,2021-08-19T19:16:59Z,10 Information Technology Stocks With Unusual Options Alerts In Today's Session, This unusual options alert can help traders track potentially big trading opportunities. Traders often look for circumstances when the market estimation of an option diverges away from its normal worth. Unusual trading activity could push option prices to hyperbolic or underperforming levels. 
584,NVDA,2021-08-20T15:08:24Z,"Clover Health Trades Higher With Other WallStreetBets Stocks, But Still Could Use A Good Bounce","Clover Health Investments Corp. (NASDAQ: CLOV) shares were moving higher Friday, pushing higher alongside other popular Reddit Wall Street Bets Stocks."
585,NVDA,2021-08-20T14:21:35Z,Britain's Concern Over Nvidia-Arm Deal Poses Double Trouble For Nvidia - Read Why?,"
"
586,NVDA,2021-08-20T14:07:42Z,"FootLocker, Deere Become Latest Major Companies To Impress With Earnings Results","We’re on track for a losing week, though stocks continue to show resilience. "
587,NVDA,2021-08-20T13:57:43Z,Nvidia Delivered But Its Crypto Product Fell Short,"On Wednesday, Nvidia (NASDAQ: NVDA) reported its second-quarter earnings and succeeded in beating Wall Street estimates on the back of strong graphics card sales. However, its cryptocurrency chip product, CMP, had lower sales than Nvidia itself had predicted in May."
588,NVDA,2021-08-20T13:23:48Z,"Top 20 Trending Stocks On WallStreetBets As Of Friday, Aug. 20, 2021 (Via Swaggy Stocks)",
589,NVDA,2021-08-20T13:19:20Z,"Nvidia Responds To Competition And Markets Authority Statement, Says We Look Forward To The Opportunity To Address CMA's Initial Views; Says We Remain Confident That Transaction Will Benefit Arm, Its Licensees, Competition And The UK",
590,NVDA,2021-08-20T12:38:48Z,"UPDATE: UK's Competition And Markets Authority Says Is Concerned Merged NVIDIA/ARM Will Have Ability, Incentive To Harm Competitiveness Of Co. Rivals",
591,NVDA,2021-08-20T12:38:05Z,UK's Competition And Markets Authority Says Finds Competition Concerns With Nvidia's Purchase Of Arm,
592,NVDA,2021-08-20T11:07:56Z,"Alibaba, Nvidia, Clover Health, Tesla, Wish And More — Stocks WallStreetBets Is Eyeing Today","Alibaba Group Holding Ltd (NYSE: BABA), Nvidia Corporation (NASDAQ: NVDA), Tesla Inc (NASDAQ: TSLA), and Clover Health Inves"
593,NVDA,2021-08-19T22:00:30Z,"Why Josh Brown Just Compared Nvidia To Apple, Microsoft",NVIDIA Corporation (NASDAQ: NVDA) is trading higher Thursday after the company announced better-than-expected second-quarter financial results. 
594,NVDA,2021-08-19T19:00:34Z,Why Nvidia Stock Analysts Are Bullish After Q2 Earnings,"Nvidia, Inc. (NASDAQ: NVDA) reported stellar quarterly results Wednesday thanks to strong performances by its data center and gaming businesses."
595,NVDA,2021-08-19T18:23:26Z,Analysts Are Cautious Post Nvidia's Q2 Results,Several analysts raised price targets on NVIDIA Corp (NASDAQ: NVDA) after beating
596,NVDA,2021-08-19T15:40:16Z,Why NVIDIA Shares Are Trading Higher Today,NVIDIA Corp (NASDAQ: NVDA) is trading higher Thursday after the company announced better-than-expected second-quarter earnings and multiple analyst firms raised price targets on the stock.
597,NVDA,2021-08-19T15:13:59Z,"NVIDIA Shares Mark New Session High, Up 5%; Hearing Investors Business Daily's Swing Trader Names Stock A Pick",
598,NVDA,2021-08-19T14:22:48Z,Analyzing NVIDIA's Unusual Options Activity," Shares of NVIDIA (NASDAQ:NVDA) saw some unusual options activity on Thursday. Following the unusual option alert, the stock price moved down to $188.85. "
599,NVDA,2021-08-19T14:11:09Z,In A Rut: Worst Week In A Month Continues As Volatility Heats Up After Fed Minutes,"In boxing, they say it’s the punch you don’t see coming that hurts the most. It’s the opposite today on Wall Street, where stocks are falling sharply despite a blow from the Fed that almost everyone probably knew was in the works."
600,NVDA,2021-08-19T14:10:18Z,"Benzinga's Top Ratings Upgrades, Downgrades For August 19, 2021", 
601,NVDA,2021-08-19T13:37:42Z,"Top 20 Trending Stocks On WallStreetBets As Of Thursday, Aug. 19, 2021 (Via Swaggy Stocks)",
602,NVDA,2021-08-19T12:26:47Z,"Deutsche Bank Maintains Hold on NVIDIA, Raises Price Target to $185",
603,NVDA,2021-08-19T12:05:41Z,"Credit Suisse Maintains Outperform on NVIDIA, Raises Price Target to $225",
604,NVDA,2021-08-19T11:51:35Z,10 Biggest Price Target Changes For Thursday,"
	Needham boosted the price target on  NVIDIA Corporation  (NASDAQ: NVDA) from $200 to $245. NVIDIA shares rose 1.8% to $193.78 in pre-market trading.
"
605,NVDA,2021-08-19T11:34:06Z,"Rosenblatt Maintains Buy on NVIDIA, Raises Price Target to $300",
606,NVDA,2021-08-19T11:14:56Z,"Mizuho Maintains Buy on NVIDIA, Raises Price Target to $235",
607,NVDA,2021-08-19T10:55:31Z,"Palantir, Clover Health, Robinhood, Nvidia, AMC And More — Stocks Trending On WallStreetBets Today","Palantir Technologies Inc. (NYSE: PLTR), Clover Health Investments Corp."
608,NVDA,2021-08-19T10:39:13Z,Summit Insights Group Downgrades NVIDIA to Sell,
609,NVDA,2021-08-19T10:36:34Z,"Barclays Maintains Overweight on NVIDIA, Raises Price Target to $225",
610,NVDA,2021-08-19T10:00:42Z,A Peek Into The Markets: US Stock Futures Plunge Ahead Of Jobless Claims; Crude Oil Down Over 3%,Pre-open movers
611,NVDA,2021-08-19T09:32:40Z,"Needham Maintains Buy on NVIDIA, Raises Price Target to $245",
612,NVDA,2021-08-19T08:41:38Z,"5 Stocks To Watch For August 19, 2021","Some of the stocks that may grab investor focus today are:
	Wall Street expects  Macy&#39;s Inc (NYSE: M) to report quarterly earnings at $0.14 per share on revenue of $4.98 billion before the opening bell. Macy&#39;s shares rose 0.4% to $18.14 in after-hours trading.
"
613,NVDA,2021-08-19T08:36:27Z,"Keybanc Maintains Overweight on NVIDIA, Raises Price Target to $245",
614,NVDA,2021-08-18T20:24:29Z,NVIDIA shares were trading lower after the company reported Q2 earnings results.,
615,NVDA,2021-08-18T20:49:35Z,Nvidia CFO Says 'Discussions With Regulators Are Taking Longer Than Initially Thought' On $40B ARM Deal,
616,NVDA,2021-08-18T20:45:46Z,NVIDIA: Q2 Earnings Insights,"Shares of NVIDIA (NASDAQ:NVDA) increased in after-market trading after the company reported Q2 results.

Quarterly Results

Earnings per share fell 52.29% over the past year to $1.04, which beat the estimate of $1.02."
617,NVDA,2021-08-18T20:22:16Z,NVIDIA Sees Q3 Sales $6.8B +/- 2% vs $6.53B Est.,
618,NVDA,2021-08-18T20:21:15Z,"NVIDIA Q2 Adj. EPS $1.04 Beats $1.02 Estimate, Sales $6.51B Beat $6.33B Estimate",
619,NVDA,2021-08-18T17:57:41Z,10 Information Technology Stocks Showing Unusual Options Activity In Today's Session, This unusual options alert can help traders discover the next big trading opportunities. Traders will search for circumstances when the market estimation of an option diverges heavily from its normal worth. Unusual trading activity could push option prices to exaggerated or underestimated levels. 
620,NVDA,2021-08-18T15:20:25Z,Mike Khouw Sees Unusual Options Activity In Nvidia,"On CNBC&#39;s &#34;Options Action,&#34; Mike Khouw said calls outpaced puts by about 2 to 1 on Tuesday."
621,NVDA,2021-08-18T14:51:42Z,Looking into NVIDIA's Return on Capital Employed," After pulling data from Benzinga Pro it seems like during Q1, NVIDIA (NASDAQ:NVDA) earned $1.96 billion, a 29.79% increase from the preceding quarter. NVIDIA also posted a total of $5.66 billion in sales, a 13.15% increase since Q4."
622,NVDA,2021-08-18T14:10:40Z,Fed Minutes Ahead Could Offer Insight Following Wall Street's Worst Day In A Month,“Buy the dip” is facing its toughest test in a month. 
623,NVDA,2021-08-18T08:49:58Z,"Cathie Wood Can't Get Enough Of Peter Thiel's Palantir, Adds Another $11.4M Shares","Cathie Wood-led Ark Invest on Tuesday further increased the exposure in Palantir Technologies Inc (NYSE: PLTR), continuing its buying spree in the Peter Thiel-co-founded data analytics company on the dip."
624,NVDA,2021-08-18T13:30:45Z,"Top 20 Trending Stocks On WallStreetBets As Of Wednesday, Aug. 18, 2021 (Via Swaggy Stocks)",
625,NVDA,2021-08-18T13:25:47Z,"Cathie Wood's ARK Invest Posts Fund Sales For Tuesday, Aug. 17, 2021: SRPT, RHHBY, REGN, NVS, TXG, SHOP, DOCU, SE, PRLB, NTDOY, NSTG, MCRB, IOVA, XONE, BYDDY, BIDU, ANSS, NVDA, TRMB",
626,NVDA,2021-08-18T10:10:01Z,A Peek Into The Markets: US Stock Futures Mostly Lower Ahead Of Fed Minutes,Pre-open movers
627,NVDA,2021-08-18T09:34:53Z,"Earnings Scheduled For August 18, 2021"," 

Companies Reporting Before The Bell

• Digital Ally (NASDAQ:DGLY) is likely to report quarterly loss at $0.04 per share on revenue of $2.70 million."
628,NVDA,2021-08-18T09:32:40Z,Baidu Plans Future In AI And Autonomous Driving,"
"
629,NVDA,2021-08-18T07:24:55Z,"7 Stocks To Watch For August 18, 2021","Some of the stocks that may grab investor focus today are:
	Wall Street expects  Lowe`s Companies Inc (NYSE: LOW) to report quarterly earnings at $4.00 per share on revenue of $26.79 billion before the opening bell. Lowe`s shares fell 0.3% to $181.80 in after-hours trading.
"
630,NVDA,2021-08-17T17:04:28Z,"Apple Chip Supplier TSMC's Market-Cap Leapfrogs Above High-Profile Chinese Tech Stalwarts Tencent, Alibaba",Apple Inc (NASDAQ: AAPL) chip supplier Taiwan Semiconductor Manufacturing Co. Ltd. (NYSE: TSM) is making waves in the stock market.
631,NVDA,2021-08-17T14:15:03Z,"Shanghai Softness: China's Weakness Spills Into US Trading, With Tech Under Pressure","If the phrase, “Never sell a dull market” needs a perfect example, yesterday might be the one. We had a really impressive rally despite very little market-related news. Today, the long streak of positive performances appears to be threatened. "
632,NVDA,2021-08-17T15:08:00Z,Understanding NVIDIA's Unusual Options Activity," On Tuesday, shares of NVIDIA (NASDAQ:NVDA) saw unusual options activity. After the option alert, the stock price moved down to $197.31. "
633,NVDA,2021-08-17T14:05:55Z,The Tech Side Of The Earnings Week Ahead,"Besides retailing earnings reports, Cisco (NASDAQ: CSCO), Nvidia (NASDAQ: NVDA), and Applied Materials (NASDAQ: AMAT) are schedule"
634,NVDA,2021-08-16T14:12:25Z,"Retail Kicks Off Final Stretch Of Earnings Season Amid A Slew Of Manufacturing, Retail, And Housing Data",It’s a shopping extravaganza this week as retailers line up to report. 
635,NVDA,2021-08-16T16:35:34Z,10 Information Technology Stocks With Unusual Options Alerts In Today's Session, This unusual options alert can help traders track potentially big trading opportunities. Traders often look for circumstances when the market estimation of an option diverges away from its normal worth. Unusual trading activity could push option prices to hyperbolic or underperforming levels. 
636,NVDA,2021-08-16T16:11:13Z,Why This Nvidia Analyst Expects Strong Q2 Report,"NVIDIA Corporation (NASDAQ: NVDA) is scheduled to report its second-quarter results Wednesday after the close.

The Nvidia Analyst:  Rosenblatt Securities analyst Hans Mosesmann reiterated a Buy rating and $250 price target for Nvidia shares."
637,NVDA,2021-08-15T14:02:31Z,Why These Investors Are So Bullish On Nvidia Ahead Of Earnings,"The CNBC investor panel on Friday discussed NVIDIA Corp (NASDAQ: NVDA) ahead of its upcoming earnings report.

Nvidia is the &#34;gold standard&#34; in the semiconductor space, Odyssey Capital Advisors&#39; Jason Snipe said."
638,NVDA,2021-08-13T17:08:51Z,Analyzing NVIDIA's Unusual Options Activity, NVIDIA (NASDAQ:NVDA) shares experienced unusual options activity on Friday. The stock price moved up to $200.35 following the option alert. 
639,NVDA,2021-08-13T17:07:06Z,Hearing Trader Mark Minervini Long NVIDIA; Unconfirmed,
640,NVDA,2021-08-13T15:51:13Z,"This Semiconductor Company Has A Better 1-Year Return Than Amazon, Apple, Netflix And Microsoft","Since 1993, NVIDIA Corporation (NASDAQ: NVDA) has been helping gamers play their favorite titles the way they&#39;re meant to be played. It&#39;s no secret investors have been getting in on the action."
641,NVDA,2021-08-13T14:08:28Z,Price To Earnings Ratio Insights For NVIDIA, 
642,NVDA,2021-08-13T12:43:01Z,"Benzinga Pro's Top 5 Stocks To Watch For Friday, Aug. 13, 2021: HD, NVDA, TWTR, WISH, UPST",
643,NVDA,2021-08-13T11:31:18Z,"Cramer Shares His Thoughts On Moderna, Nvidia And More","On CNBC&#39;s &#34;Mad Money Lightning Round,&#34; Jim Cramer said Karyopharm Therapeutics Inc (NASDAQ: KPTI) is nothing special."
644,NVDA,2021-08-12T17:41:38Z,Why Nvidia Is Much More Than Just A Chip Stock,"Investors who think of NVIDIA Corp (NASDAQ: NVDA) as a chip stock are missing the point, Ritholtz Wealth Management CEO Josh Brown said Thursday on CNBC&#39;s &#34;Fast Money Halftime Report.&#34;"
645,NVDA,2021-08-12T16:35:45Z,10 Information Technology Stocks Showing Unusual Options Activity In Today's Session, This unusual options alert can help traders track potentially big trading opportunities. Traders often look for circumstances when the market estimation of an option diverges away from its normal worth. Unusual trading activity could push option prices to hyperbolic or underperforming levels. 
646,NVDA,2021-08-12T15:32:38Z,NVIDIA Shares Mark New Session High Over $199; UBS Raises Price Target To $230,
647,NVDA,2021-08-12T13:26:19Z,"Evercore ISI Group Maintains Outperform on NVIDIA, Raises Price Target to $250",
648,NVDA,2021-08-12T12:30:05Z,"UBS Maintains Buy on NVIDIA, Raises Price Target to $230",
649,NVDA,2021-08-12T12:22:25Z,"Wells Fargo Maintains Overweight on NVIDIA, Raises Price Target to $245",
650,NVDA,2021-08-11T16:35:46Z,10 Information Technology Stocks Showing Unusual Options Activity In Today's Session, This unusual options alert can help traders discover the next big trading opportunities. Traders will search for circumstances when the market estimation of an option diverges heavily from its normal worth. Unusual trading activity could push option prices to exaggerated or underestimated levels. 
651,NVDA,2021-08-11T14:15:13Z,"Cathie Wood's ARK Invest Posts Fund Sales For Tuesday, Aug. 10, 2021: SEER, TAK, RHHBY, REGN, PSTG, NVS, CLLS, BMY, TXG, SQ, SHOP, SE, NTDOY, MCRB, DOCU, NVDA, NFLX, BABA",
652,NVDA,2021-08-11T09:44:49Z,"Netflix, Nvidia, DraftKings, Alibaba, Square — Stocks Cathie Wood's Ark Bought Or Sold Tuesday","Cathie Wood-led Ark Invest on Tuesday further reduced its exposure in Netflix Inc (NASDAQ: NFLX) by about 71% as it shed 75,109 shares — estimated to be worth about $38.74 million — in the streaming video-on-demand service provider. "
653,NVDA,2021-08-10T09:12:37Z,"Cathie Wood Sells $7.7M In Netflix, $3M In Nvidia","Cathie Wood-led Ark Invest on Monday reduced its exposure in Netflix Inc (NASDAQ: NFLX) by 12.3%, as it shed 14,762 shares — estimated to be worth about $7.68 million — in the online video streaming service."
654,NVDA,2021-08-10T16:59:56Z,9 Information Technology Stocks With Unusual Options Alerts In Today's Session, This unusual options alert can help traders track potentially big trading opportunities. Traders often look for circumstances when the market estimation of an option diverges away from its normal worth. Unusual trading activity could push option prices to hyperbolic or underperforming levels. 
655,NVDA,2021-08-10T15:40:00Z,"UPDATE: NVIDIA Announces New Integrations With Blender, Adobe",
656,NVDA,2021-08-10T15:38:36Z,NVIDIA Highlights Expanded Omniverse Platform,
657,NVDA,2021-08-10T14:17:46Z,The Dog Days Aren't Over: Wait And See Mode For Now As Key Inflation Data Ahead,"Whoever thought up the expression “dog days of summer” probably had mornings like this in mind. 

Looking around for news, it’s hard to find much. And U.S. markets didn’t move very far overnight. European trading hasn’t provided a lot of direction, either, though stocks did rise pretty nicely across the Pacific in China. "
658,NVDA,2021-08-09T17:07:35Z,Understanding NVIDIA's Unusual Options Activity," Shares of NVIDIA (NASDAQ:NVDA) saw some unusual options activity on Monday. Following the unusual option alert, the stock price moved down to $203.34. "
659,NVDA,2021-08-09T16:36:24Z,10 Information Technology Stocks With Unusual Options Alerts In Today's Session, This unusual options alert can help traders discover the next big trading opportunities. Traders will search for circumstances when the market estimation of an option diverges heavily from its normal worth. Unusual trading activity could push option prices to exaggerated or underestimated levels. 
660,NVDA,2021-08-06T16:35:37Z,10 Information Technology Stocks Showing Unusual Options Activity In Today's Session,This unusual options alert can help traders discover the next big trading opportunities. Traders will search for circumstances when the market estimation of an option diverges heavily from its normal worth. Unusual trading activity could push option prices to exaggerated or underestimated levels. 
661,NVDA,2021-08-06T07:04:03Z,"Warren Buffett-Backed BYD Sold More EVs In July Than Nio, Xpeng, Li's Combined Deliveries","The Shenzhen-based, Chinese automaker BYD Co’s (OTC: BYDDF) all-electric vehicle sales more than doubled in July and the company sold more vehicles than the combined delivery numbers of the three homegrown newcomers Nio Inc (NYSE: "
662,NVDA,2021-08-06T14:10:16Z,Understanding NVIDIA's Unusual Options Activity,NVIDIA (NASDAQ:NVDA) shares experienced unusual options activity on Friday. The stock price moved down to $204.41 following the option alert. 
663,NVDA,2021-08-05T19:41:15Z,Hearing President Biden Says Never Should Be In Situation Like Semiconductor Shortage,
664,NVDA,2021-08-05T16:37:30Z,10 Information Technology Stocks With Unusual Options Alerts In Today's Session, This unusual options alert can help traders track potentially big trading opportunities. Traders often look for circumstances when the market estimation of an option diverges away from its normal worth. Unusual trading activity could push option prices to hyperbolic or underperforming levels. 
665,NVDA,2021-08-04T21:20:39Z,"Nvidia To Report Q2 Results On Wednesday, August 18 After Market Close",
666,NVDA,2021-08-04T14:12:57Z,"TSMC To Land Sub-7nm Chip Orders From Qualcomm, Nvidia",
667,NVDA,2021-08-04T09:33:29Z,What Is Fueling The AMD Rally?,Shares of Advanced Micro Devices Inc. (NASDAQ: AMD) extended gains to a fifth straight day and closed 3.6% higher in Tuesday’s regular trading session.
668,NVDA,2021-08-04T11:02:47Z,"Rosenblatt Maintains Buy on NVIDIA, Raises Price Target to $250",
669,NVDA,2021-08-03T20:20:06Z,Analyzing NVIDIA's Unusual Options Activity, NVIDIA (NASDAQ:NVDA) shares experienced unusual options activity on Tuesday. The stock price moved up to $197.69 following the option alert. 
670,NVDA,2021-08-03T15:44:33Z,"NVIDIA Says Continues To Work Through Regulatory Process With UK Gov't., Related To ARM Deal",
671,NVDA,2021-08-03T15:42:39Z,"Why Former NYSE Trader David Green Bought NVIDIA, Tesla, and Cassava Sciences On Tuesday","Veteran trader David Green was back live trading on Benzinga Tuesday morning, and the long-time trader made some moves. "
672,NVDA,2021-08-03T15:18:10Z,"UPDATE: UK Could Still Approve ARM Deal By NVIDIA With Certain Conditions, UK Likely To Conduct Deeper Review Into Deal",
673,NVDA,2021-08-03T15:14:50Z,NVIDIA Shares Fall Amid Report UK Is Considering Blocking Co.'s Takeover Of ARM,
674,NVDA,2021-08-03T05:39:05Z,"Cathie Wood Sells $55M In Square After Earnings Report, Trims $15M In Snapchat And Buys $1.2M In Amazon",Cathie Wood-led Ark Invest on Monday rushed to book profit in Square Inc (NYSE: SQ) as the shares of the company skyrocketed after the second-quarter earnings result and the $29 billion Afterpay acquisition. 
675,NVDA,2021-08-02T18:53:01Z,Unusual Options Activity Insight: NVIDIA, NVIDIA (NASDAQ:NVDA) shares experienced unusual options activity on Monday. The stock price moved up to $198.76 following the option alert. 
676,NVDA,2021-08-02T17:21:03Z,10 Information Technology Stocks Showing Unusual Options Activity In Today's Session, This unusual options alert can help traders track potentially big trading opportunities. Traders often look for circumstances when the market estimation of an option diverges away from its normal worth. Unusual trading activity could push option prices to hyperbolic or underperforming levels. 
677,NVDA,2021-07-30T16:37:07Z,10 Information Technology Stocks Showing Unusual Options Activity In Today's Session, This unusual options alert can help traders track potentially big trading opportunities. Traders often look for circumstances when the market estimation of an option diverges away from its normal worth. Unusual trading activity could push option prices to hyperbolic or underperforming levels. 
678,NVDA,2021-07-30T15:57:43Z,Unusual Options Activity Insight: NVIDIA," On Friday, shares of NVIDIA (NASDAQ:NVDA) saw unusual options activity. After the option alert, the stock price moved down to $194.01. "
679,NVDA,2021-07-30T14:05:31Z,AMD's Q2 Results Have All The Chips In Place,Shares of Advanced Micro Devices (NASDAQ: AMD) have been rising after the semiconductor company reported its second-quarter earnings that beat analyst predictions with a stick.
680,NVDA,2021-07-30T13:03:29Z,'China Antitrust Officials Delay Review of Nvidia's $40 Billion Arm Acquisition' -The Information Report,
681,NVDA,2021-07-29T22:38:11Z,5 Of The Best Stocks To Buy In Last Year's 'COVID Crash',"Last March, the S&amp;P 500 dropped more than 30% in a rapid fashion at the onset of the COVID-19 pandemic. Investors panic sold throughout the crash, bringing big-name stocks down to extremely low levels.

In retrospect, these five stocks were some of the best to buy at a discount."
682,NVDA,2021-07-29T18:23:20Z,Understanding NVIDIA's Unusual Options Activity, NVIDIA (NASDAQ:NVDA) shares experienced unusual options activity on Thursday. The stock price moved up to $196.95 following the option alert. 
683,NVDA,2021-07-28T22:39:56Z,"Facebook Bets Big On Metaverse: Why It's Important For The Industry, FB Stock","Earlier this month, Facebook Inc (NASDAQ: FB) CEO Mark Zuckerberg told employees the company would put new emphasis on growing the metaverse."
684,NVDA,2021-07-28T16:50:05Z,8 Information Technology Stocks Showing Unusual Options Activity In Today's Session, This unusual options alert can help traders track potentially big trading opportunities. Traders often look for circumstances when the market estimation of an option diverges away from its normal worth. Unusual trading activity could push option prices to hyperbolic or underperforming levels. 
685,NVDA,2021-07-28T16:41:40Z,Unusual Options Activity Insight: NVIDIA," Shares of NVIDIA (NASDAQ:NVDA) saw some unusual options activity on Wednesday. Following the unusual option alert, the stock price moved up to $195.5. "
