,ticker,timestamp,headline,summary
0,NVDA,2022-02-10T18:00:03Z,"CNBC Final Trades:  Iqvia, NVIDIA, Wynn",
1,NVDA,2022-02-10T17:49:09Z,"Top 10 WallStreetBets Mentions for Thursday February 10, 2022 Since 9:30 AM ET Open: GME, UBER, AMC, TSLA, NVDA, DIS, CLF, AMD, SAVA, AFRM",
2,NVDA,2022-02-10T17:46:00Z,10 Information Technology Stocks Whale Activity In Today's Session,"This whale alert can help traders discover the next big trading opportunities.
Whales are entities with large sums of money and we track their transactions here at Benzinga on our options activity scanner."
3,NVDA,2022-02-10T16:27:34Z,How To Not Get Crushed: Investing Cautiously Ahead Of The Fed's Rate Tightening.,"Cottonbro/Pexels

Stock Picking Gets Harder "
4,NVDA,2022-02-10T15:46:37Z,"Benzinga's Daily Brief On Trending Tickers For Feb. 10, 2022: GameStop, Twitter, Disney and More","Benzinga’s “Daily Brief On Trending Tickers” highlights top-searched tickers from around the web and uses the Benzinga Pro platform to highlight recent news items possibly impacting those stocks.

The data on the trending tickers is compiled from a list of most-discussed tickers on the popular Reddit forum WallStreetBets."
5,NVDA,2022-02-10T13:49:38Z,"Top 10 WallStreetBets Mentions for Morning Of Thursday, Feb. 10, 2022: GME, TWTR, DIS, NVDA, TSLA, RBLX, PTON, AMD, AMC, PLTR",
6,NVDA,2022-02-09T18:57:17Z,Why Nvidia Shares Are Trading Higher Today,NVIDIA Corp (NASDAQ: NVDA) is trading higher Wednesday following the company&#39;s termination of its planned acquisition of British semiconductor company Arm Limited from SoftBank.
7,NVDA,2022-02-09T17:48:15Z,10 Information Technology Stocks Whale Activity In Today's Session,"This whale alert can help traders discover the next big trading opportunities.
Whales are entities with large sums of money and we track their transactions here at Benzinga on our options activity scanner."
8,NVDA,2022-02-09T17:27:58Z,"Top 10 WallStreetBets Mentions for Wednesday February 9, 2022 Since 9:30 AM ET Open: GME, PTON, NVDA, DIS, AMC, TSLA, AMD, TLRY, CRSR, PYPL",
9,NVDA,2022-02-09T16:31:00Z,"Benzinga's Daily Brief On Trending Tickers For Feb. 9, 2022: Peloton, GameStop And More",Benzinga’s “Daily Brief On Trending Tickers” highlights top-searched tickers from around the web and uses the Benzinga Pro platform to highlight recent news items possibly impacting those stocks.
10,NVDA,2022-02-09T15:50:05Z,"US Secretary Of Commerce Gina Raimondo Says Once 'Chips Act' Passes, Will Unlock Private Capital Into Space",
11,NVDA,2022-02-09T15:42:00Z,'HAPPENING TODAY: An exclusive interview with @Arm's new CEO @renehaas237. 11:30 am ET / 8:30 am PT Only on @CNBCTechCheck' -Tweet From CNBC Show; BZ NOTE: NVIDIA Shares Could See Volatility Amid This Interview,
12,NVDA,2022-02-09T14:32:55Z,"Top 10 WallStreetBets Mentions for Morning Of Wednesday, Feb. 9, 2022: PTON, GME, AMD, NVDA, TSLA, DIS, BABA, CRSR, TLRY, CVS",
13,NVDA,2022-02-09T13:38:21Z,"SoftBank Looks To List Arm In US, Ditching Its Home Market","
"
14,NVDA,2022-02-09T12:25:28Z,Facebook Parent Meta Falls Behind Nvidia,"
"
15,NVDA,2022-02-09T11:46:51Z,SoftBank CEO Masayoshi Son Said he Plans to List Arm in New York after the Nvidia Takeover Collapsed,
16,NVDA,2022-02-08T20:38:58Z,Here's Why Citi Is Still Bullish On Nvidia Despite Arm Deal Fall Out,"
"
17,NVDA,2022-02-08T17:40:05Z,10 Information Technology Stocks With Whale Alerts In Today's Session,"This whale alert can help traders discover the next big trading opportunities.
Whales are entities with large sums of money and we track their transactions here at Benzinga on our options activity scanner."
18,NVDA,2022-02-08T17:30:23Z,"Top 10 WallStreetBets Mentions for Tuesday February 8, 2022 Since 9:30 AM ET Open:  PTON, GME, NVDA, AMD, TSLA, AMZN, SNAP, AAPL, CHGG, CLF",
19,NVDA,2022-02-08T16:52:29Z,NVIDIA Whale Trades Spotted,"Someone with a lot of money to spend has taken a bearish stance on NVIDIA (NASDAQ:NVDA).
And retail traders should know.
We noticed this today when the big position showed up on publicly available options history that we track here at Benzinga."
20,NVDA,2022-02-08T13:15:15Z,Nvidia Says It Will Retain Its 20-Year ARM License,
21,NVDA,2022-02-08T13:14:56Z,"NVIDIA 8-K Shows Co., Softbank, SVF Holdco Mutually Terminated Share Purchase Deal Dated Sept. 13, 2020",
22,NVDA,2022-02-08T13:14:52Z,UPDATE: Nvidia Says Charge In Q1 2023 Is Inclusive Of $1.25B Prepayment Provided At Signing Of ARM Deal,
23,NVDA,2022-02-08T13:14:08Z,Nvidia Intends To Record A $1.36B Charge In Q1 2023 After Co Terminated Share Purchase Agreement Of ARM,
24,NVDA,2022-02-07T18:58:33Z,7 Of The Best Nasdaq Stocks to Buy On The Dip,"The S&amp;P 500 is off to a shaky start to 2022, down 5.5% year-to-date. As bad as things have been for the S&amp;P 500, they have been even worse for the tech-heavy Nasdaq Composite, which is down 9.9% so far in this year."
25,NVDA,2022-02-08T12:52:13Z,U.S Equity Futures Lower; Nvidia-Arm Deal Called Off; Pfizer Lower on Sales Miss; U.S. Inflation Data to be Released on Thursday,
26,NVDA,2022-02-08T11:22:13Z,SoftBank Aims For Arm IPO After Nvidia Dumps Takeover Plans,"
"
27,NVDA,2022-02-08T10:58:00Z,SoftBank Clocks 6% Revenue Growth In Q3,"
"
28,NVDA,2022-02-08T09:48:11Z,NVIDIA and SoftBank Group Confirmed Termination of NVIDIA's Acquisition of Arm Limited,
29,NVDA,2022-02-07T20:32:08Z,Why Nvidia Shares Are Rising,"Shares of semiconductor companies, including NVIDIA Corporation (NASDAQ: NVDA), are trading higher in sympathy with ON Semiconductor Corp (NASDAQ: ON), which reported better-than-expected fourth-quarter results "
30,NVDA,2022-02-07T19:17:30Z,"Chart Wars: Between Nvidia, Taiwan Semiconductor, Which Stock Looks Set To Fly Higher?","NVIDIA Corporation (NASDAQ: NVDA) and Taiwan Semiconductor Manufacturing Company, Ltd. (NYSE: TSM) were each trading 1% higher on Monday despite the broad sector ETF SPDR S&amp;P 500 consolidating with an inside bar p"
31,NVDA,2022-02-06T16:42:50Z,"10 Most Searched Tickers On Benzinga In January: SPY, Tesla, Apple And More","Each trading day features hundreds of headlines and press releases about companies. Benzinga Pro is a source for traders to see the latest news on the overall market and also on individual tickers.

Here is a look at the stocks that were searched for the most on Benzinga Pro for the month of January."
32,NVDA,2022-02-04T18:14:01Z,"Top 10 WallStreetBets Mentions for Friday February 4, 2022 Since 9:30 AM ET Open: AMZN, SNAP, GME, TSLA, HOOD, ARKK, DTE, AAPL, AMD, NVDA",
33,NVDA,2022-02-04T17:42:35Z,10 Information Technology Stocks Whale Activity In Today's Session,"This whale alert can help traders discover the next big trading opportunities.
Whales are entities with large sums of money and we track their transactions here at Benzinga on our options activity scanner."
34,NVDA,2022-02-04T16:30:06Z,US House Formally Passes China Competition Bill To Boost US Chip-Making,
35,NVDA,2022-02-04T16:23:11Z,House Vote On bill To Boost US Chip Production Is Ongoing,
36,NVDA,2022-02-04T16:20:29Z,New Street Cautions Against Nvidia's Steep Downside: All You Need To Know,"
	With Ethereum ($ETH) down over 40% from the peak, mining volumes should decline in the next six months, crypto demand for graphics processing units will &#34;die,&#34; and excess mining GPUs will hit the gaming market New Street analyst Pierre Ferragu tells.
"
37,NVDA,2022-02-03T17:41:46Z,10 Information Technology Stocks With Whale Alerts In Today's Session,"This whale alert can help traders discover the next big trading opportunities.
Whales are entities with large sums of money and we track their transactions here at Benzinga on our options activity scanner."
38,NVDA,2022-02-03T14:42:32Z,"CNBC's Final Trades: Nvidia, Stryker, Qualcomm, Marathon Digital And A Stock That Balances Growth And Value","On CNBC’s “Halftime Report Final Trades,” Pete Najarian named Nvidia Corporation (NASDAQ: NVDA) as his pick, saying that options traders had bought more than 20,000 of the 260 calls that expire o"
39,NVDA,2022-02-02T21:36:30Z,McDonald's Enters The Metaverse: What Investors Need To Know,McDonald&#39;s Corp (NYSE: MCD) celebrated the lunar New Year in the metaverse this year. The iconic fast food chain launched an immersive and interactive experience for fans using a collection of zodiac animal designs.
40,NVDA,2022-02-02T20:04:00Z,"This Biopharmaceutical Company Has A Better 3-Month Return Than Apple, Starbucks, Nvidia And Microsoft","Vertex Pharmaceuticals Incorporated (NASDAQ: VRTX) creates new possibilities via medicine to cure diseases and improve people&#39;s lives, and over the past three months, marked gains to investors’ portfolios."
41,NVDA,2022-02-02T17:59:58Z,Trader Pete Najarian Says He Bought Calls In NVIDIA,
42,NVDA,2022-02-02T17:59:39Z,"CNBC Final Trades: NVIDIA, Stryker, Qualcomm, CVS, Marathon Digital",
43,NVDA,2022-02-02T17:44:29Z,10 Information Technology Stocks With Whale Alerts In Today's Session,"This whale alert can help traders discover the next big trading opportunities.
Whales are entities with large sums of money and we track their transactions here at Benzinga on our options activity scanner."
44,NVDA,2022-02-02T13:14:31Z,12 Information Technology Stocks Moving In Wednesday's Pre-Market Session, 
45,NVDA,2022-02-02T11:33:55Z,23 Stocks Moving in Wednesday's Pre-Market Session,"Gainers

 "
46,NVDA,2022-02-01T22:11:47Z,"Top 10 WallStreetBets Mentions for Tuesday February 1, 2022 Since 4:00 PM ET Close:  AMD, PYPL, GOOGL, GOOG, MTCH, NVDA, SBUX, AMZN, AAPL, GME",
47,NVDA,2022-02-01T21:57:49Z,12 Information Technology Stocks Moving In Tuesday's After-Market Session,"Gainers

"
48,NVDA,2022-02-01T19:37:45Z,"Intel, AMD Shares See Volatility On Volume But Largely Unaffected Following Headline China Will Start An Organization For Chip Collab. With Intel, AMD",
49,NVDA,2022-02-01T18:47:22Z,Check Out What Whales Are Doing With NVDA,"Someone with a lot of money to spend has taken a bearish stance on NVIDIA (NASDAQ:NVDA).
And retail traders should know.
We noticed this today when the big position showed up on publicly available options history that we track here at Benzinga."
50,NVDA,2022-02-01T17:46:35Z,10 Information Technology Stocks Whale Activity In Today's Session,"This whale alert can help traders discover the next big trading opportunities.
Whales are entities with large sums of money and we track their transactions here at Benzinga on our options activity scanner."
51,NVDA,2022-02-01T12:52:16Z,"Top 10 WallStreetBets Mentions for Tuesday February 1, 2022 Premarket: GME, TSLA, AMC, AMD, UPS, NVDA, PLTR, MTCH, WISH, IBKR",
52,NVDA,2022-02-01T12:19:53Z,NVIDIA Shares Move Slightly Higher; Hearing Raymond James Adds Stock To Its Analyst Current Favorites List,
53,NVDA,2022-01-31T17:36:09Z,10 Information Technology Stocks Whale Activity In Today's Session,"This whale alert can help traders discover the next big trading opportunities.
Whales are entities with large sums of money and we track their transactions here at Benzinga on our options activity scanner."
54,NVDA,2022-01-31T15:14:20Z,Why AMD And NVIDIA Shares Are Rising Today,"Shares of technology companies such as Advanced Micro Devices, Inc. (NASDAQ: AMD) and NVIDIA Corporation (NASDAQ: NVDA) are trading higher as the sector rebounds following a sharp selloff this month."
55,NVDA,2022-01-28T19:39:10Z,Errors By Novice Technicians,"
It&#39;s taken me years to figure out how to navigate the markets with a chart and technicals.  When I first started reading up on charting techniques there were very few options available and very little published about the topic.  But eventually I learned the skills necessary and to this day continue to gather knowledge, there is just so much to learn.

"
56,NVDA,2022-01-28T17:38:24Z,10 Information Technology Stocks With Whale Alerts In Today's Session,"This whale alert can help traders discover the next big trading opportunities.
Whales are entities with large sums of money and we track their transactions here at Benzinga on our options activity scanner."
57,NVDA,2022-01-28T16:46:15Z,Turning Slightly Bearish: A Bearish ETF Hits Our Top Ten Names. How To Handle Market Inflection Points.,"Janko Ferlic/Pexels.

A Bearish ETF Hits Our Top Ten"
58,NVDA,2022-01-28T15:18:16Z,NVIDIA Whale Trades For January 28,"A whale with a lot of money to spend has taken a noticeably bearish stance on NVIDIA.
Looking at options history for NVIDIA (NASDAQ:NVDA) we detected 17 strange trades."
59,NVDA,2022-01-27T20:27:18Z,"Apple, Microsoft And Nvidia Shares Are All At Support: Will These Levels Hold Firm?","In my last Benzinga post which you can read here, I analyzed the S&amp;P 500 in relation to the daily 200 simple moving average (SMA) and how I use it to give me a bias to price action. "
60,NVDA,2022-01-27T18:01:15Z,10 Information Technology Stocks Whale Activity In Today's Session,"This whale alert can help traders discover the next big trading opportunities.
Whales are entities with large sums of money and we track their transactions here at Benzinga on our options activity scanner."
61,NVDA,2022-01-27T16:50:12Z,"Top 10 WallStreetBets Mentions for January 27, 2022 Since 9:30 AM ET Open: TSLA, GME, HOOD, AMD, AAPL, INTC, MSFT, LCID, NVDA, NFLX",
62,NVDA,2022-01-27T13:19:40Z,"Top 10 WallStreetBets Mentions for January 27, 2022 Premarket: GME, AMD, TSLA, AAPL, NFLX, HOOD, XLNX, NVDA, MSFT, BABA",
63,NVDA,2022-01-26T18:46:45Z,BofA Hails Nvidia's Dumping Of Arm Takeover,"
	NVIDIA Corp&#39;s (NASDAQ: NVDA) reported plan of not proceeding with the acquisition of semiconductor licensing company Arm, a move that would be a &#34;net positive&#34; for the chip company, Bank of America said.
"
64,NVDA,2022-01-26T17:38:12Z,10 Information Technology Stocks Whale Activity In Today's Session,"This whale alert can help traders discover the next big trading opportunities.
Whales are entities with large sums of money and we track their transactions here at Benzinga on our options activity scanner."
65,NVDA,2022-01-26T15:25:43Z,Why Nvidia And Micron Shares Are Rising Today,"Shares of companies in the semiconductor space, including NVIDIA Corp (NASDAQ: NVDA) and Micron Technology Inc (NASDAQ: MU), are trading higher Wednesday, rebounding from recent weakness amid a rise in"
66,NVDA,2022-01-25T18:17:35Z,Nvidia Quietly Looks To Dump Its Arm Ambitions,"
"
67,NVDA,2022-01-25T18:02:22Z,"If You're Selling Nvidia Stock Because Of Arm Deal Developments, Jim Cramer Thinks 'You're A Fool'",Who is selling NVIDIA Corporation (NASDAQ: NVDA) with the stock already down more than 20% this month? That&#39;s the question Jim Cramer pondered Tuesday when he analyzed the semiconductor stock on CNBC&#39;s &#34;Mad Dash&#34; segment. 
68,NVDA,2022-01-25T17:42:35Z,10 Information Technology Stocks With Whale Alerts In Today's Session,"This whale alert can help traders discover the next big trading opportunities.
Whales are entities with large sums of money and we track their transactions here at Benzinga on our options activity scanner."
69,NVDA,2022-01-25T17:13:11Z,"Top 10 WallStreetBets Mentions for January 25, 2022 Since 9:30 AM Open: GME, TSLA, MSFT, AMC, AAPL, NFLX, IBM, NVDA, AMD, HOOD",
70,NVDA,2022-01-25T14:39:00Z,Why Nvidia Shares Are Sliding Today,NVIDIA Corp (NASDAQ: NVDA) is trading lower Tuesday morning following a report from Bloomberg suggesting the company is quietly preparing to abandon its purchase of British semiconductor company Arm Ltd. from SoftBank Group.
71,NVDA,2022-01-25T12:41:28Z,Bloomberg Reported Nvidia is Preparing to Abandon Its Purchase of Arm Ltd. From Softbank Group After Lack of Progress in Winning Approval for the $40B Chip Deal,
72,NVDA,2022-01-25T04:35:43Z,Crypto Crash's Silver Lining? Gaming Might Get Cheaper In 2022 As GPU Street Prices Take A Beating,"There may be a silver lining hidden in the dark cloud that is the recent cryptocurrency crash — prices of gaming hardware made by the likes of NVIDIA Corporation (NASDAQ: NVDA) and Advanced Micro Devices, Inc (NASDAQ: "
73,NVDA,2022-01-24T18:16:12Z,10 Information Technology Stocks With Whale Alerts In Today's Session,"This whale alert can help traders discover the next big trading opportunities.
Whales are entities with large sums of money and we track their transactions here at Benzinga on our options activity scanner."
74,NVDA,2022-01-24T18:04:50Z,Meta Launches Next-Gen AI Supercomputer: All You Need To Know,"
"
75,NVDA,2022-01-24T15:05:19Z,NVIDIA Whale Trades Spotted,"A whale with a lot of money to spend has taken a noticeably bullish stance on NVIDIA.
Looking at options history for NVIDIA (NASDAQ:NVDA) we detected 18 strange trades."
76,NVDA,2022-01-24T17:07:27Z,"Why Palantir Technologies, AMD And Nvidia Shares Are Falling Today","Shares of several companies in the broader tech sector, including Palantir Technologies Inc (NYSE: PLTR), Advanced Micro Devices, Inc. (NASDAQ: "
77,NVDA,2022-01-24T16:44:09Z,"Top 10 WallStreetBets Mentions for January 24, 2022 Since 9:30 AM Open: GME, TSLA, AMC, PTON, MSFT, HOOD, ARKK, NVDA, PLTR, AAPL",
78,NVDA,2022-01-24T14:14:05Z,TSMC Aims To Construct Advanced Packaging Fab In Taiwan,"Taiwan Semiconductor Manufacturing Co Ltd (NYSE: TSM) aims to build a new advanced packaging plant in Chiayi or Yunlin county, southern Taiwan, "
79,NVDA,2022-01-24T12:06:50Z,"Top WallStreetBets Mentions for Monday January 24, 2022 Premarket : TSLA, GME, PLTR, NVDA, MSFT, AMD, MRNA, AAPL, NFLX, ARKK",
80,NVDA,2022-01-23T17:02:54Z,"Top WallStreetBets Mentions for Sunday January 23, 2022: GME, TSLA, AAPL, MSFT, AMC, NFLX, PLTR, HOOD, NVDA, SOFI",
81,NVDA,2022-01-21T20:44:08Z,"'NVIDIA Silently Raises Prices of Its Entire GeForce RTX 30 Founders Edition Graphics Cards Family In Europe, Up To 6.4% Increase' -Wccftech",
82,NVDA,2022-01-21T17:55:52Z,Pete Najarain Mentions Unusual Activity In Nvdia Jan 250 Calls,
83,NVDA,2022-01-21T17:35:55Z,10 Information Technology Stocks Whale Activity In Today's Session,"This whale alert can help traders discover the next big trading opportunities.
Whales are entities with large sums of money and we track their transactions here at Benzinga on our options activity scanner."
84,NVDA,2022-01-21T17:07:54Z,Here's Why Northland Sees Huge Upside In Luminar Tech,"
	Northland analyst Gus Richard reiterated his Outperform rating and a $38 price target on Luminar Technologies Inc (NASDAQ: LAZR). The price target implies an upside of 175%.
"
85,NVDA,2022-01-21T14:07:06Z,"Top 10 WallStreetBets Mentions for January 21, 2022 Premarket: GME, NFLX, TSLA, AAPL, AMC, PTON, LCID, MSFT, NVDA, SOFI",
86,NVDA,2022-01-20T20:15:46Z,"This Oil Stock Has A Better 1-Year Return Than Apple, Microsoft, AMD And Nvidia","Marathon Oil Corporation (NYSE: MRO) is a global leader in oil production and in the past year, a big winner for bullish traders and investors. "
87,NVDA,2022-01-20T18:19:05Z,10 Information Technology Stocks With Whale Alerts In Today's Session,"This whale alert can help traders discover the next big trading opportunities.
Whales are entities with large sums of money and we track their transactions here at Benzinga on our options activity scanner."
88,NVDA,2022-01-19T20:09:18Z,"Why Applied Materials, Lam Research, Nvidia And Qualcomm Shares Are Falling Today","Shares of companies in the semiconductor sector, including Applied Materials, Inc. (NASDAQ: AMAT), Lam Research Corporation (NASDAQ: LRCX), NVIDIA Corporation (NASDAQ: "
89,NVDA,2022-01-18T20:44:22Z,"NVIDIA Shares Mark New Intraday Low Below $258, At $257.70, Down ~4.3% For Session",
90,NVDA,2022-01-18T18:32:40Z,Why Nvidia Stock Needs To See A Breakout Soon,"NVIDIA Corp. (NASDAQ: NVDA) shares were trading lower Tuesday amid a pullback in the broader technology sector. Companies in this sector are dipping after the 10-year U.S. Treasury yield reached a two-year high, which has pressured valuations."
91,NVDA,2022-01-18T18:05:58Z,Intel To Showcase Crypto-Mining Chip In February: Report,"
"
92,NVDA,2022-01-18T16:47:14Z,What Are Whales Doing With NVIDIA,"A whale with a lot of money to spend has taken a noticeably bearish stance on NVIDIA.
Looking at options history for NVIDIA (NASDAQ:NVDA) we detected 13 strange trades."
93,NVDA,2022-01-18T16:17:24Z,"Why NVIDIA, AMD And Micron Shares Are Falling Today","Shares of companies in the broader technology sector, including NVIDIA Corporation (NASDAQ: NVDA), Micron Technology, Inc. (NASDAQ: MU) and Advanced Micro Devices, Inc. (NASDAQ: "
94,NVDA,2022-01-18T16:05:18Z,"If You Invested $100 In This Stock 10 Years Ago, Here's How Much You Would Have Today",NVIDIA (NASDAQ:NVDA) has outperformed the market over the past 10 years by 39.73% on an annualized basis. 
95,NVDA,2022-01-18T12:10:38Z,"This Robot-Run ETF Retains Tesla As It Largest Holding In January, It Has Bowed Out Of Netflix And Initiated Position In This Chipmaker","The Qraft AI-Enhanced US Large Cap Momentum ETF (NYSE: AMOM), an exchange-traded fund driven by artificial intelligence, has acquired new stakes in Nvidia Corp. (NASDAQ: NVDA), Home Depot Inc. (NYSE:"
96,NVDA,2022-01-14T19:31:26Z,Epic Sidesteps Apple To Reenter iOS Devices Through Nvidia's Cloud Gaming Service; Analysts Say Move Isn't 'Viable Business Alternative',"Epic Games&#39; Fortnite, which was removed from Apple, Inc.&#39;s (NASDAQ: AAPL) app store in August 2020, has managed to circumvent the restriction and reenter Apple&#39;s iOS-powered iPhone and iPads."
97,NVDA,2022-01-14T19:19:01Z,10 Information Technology Stocks With Whale Alerts In Today's Session,"This whale alert can help traders discover the next big trading opportunities.
Whales are entities with large sums of money and we track their transactions here at Benzinga on our options activity scanner."
98,NVDA,2022-01-14T17:14:46Z,European Union Sets New May 25 Deadline For Nvidia/ARM Review,
99,NVDA,2022-01-14T16:46:22Z,NVIDIA Whale Trades Spotted,"A whale with a lot of money to spend has taken a noticeably bullish stance on NVIDIA.
Looking at options history for NVIDIA (NASDAQ:NVDA) we detected 16 strange trades."
100,NVDA,2022-01-14T15:55:37Z,"Augmented/Virtual Reality Stocks That Could Benefit Following Word Of Potential Delay To Release Of Apple's AR/VR Headset: Facebook, Google, Amazon, Vuzix, Unity, Cemtrex, NVIDIA, AMD, Matterport, Snap, iQIYI",
101,NVDA,2022-01-13T20:52:04Z,"Chip Stocks Move To New Session Lows With Broader Stocks; NVIDIA Shares Down 5%, AMD Shares Down ~4%, Intel Shares Down ~1.4%",
102,NVDA,2022-01-13T20:05:33Z,Why AMD And Nvidia Shares Are Falling Today,"Shares of several companies in the broader tech sector, including Advanced Micro Devices, Inc. (NASDAQ: AMD) and NVIDIA Corporation (NASDAQ: "
103,NVDA,2022-01-13T19:45:05Z,"Ahead Of Tech Earnings, Analyst Names Nvidia And These 4 Semiconductor Stocks As 2022 Top Picks","Following a strong showing in 2021, semiconductor companies remain on track for upside yet again in 2022 amid solid demand and lean channel inventories, according to an Oppenheimer analyst. "
104,NVDA,2022-01-13T17:40:47Z,10 Information Technology Stocks With Whale Alerts In Today's Session,"This whale alert can help traders discover the next big trading opportunities.
Whales are entities with large sums of money and we track their transactions here at Benzinga on our options activity scanner."
105,NVDA,2022-01-13T15:41:16Z,"The Verge Reports Fortnite is technically back on iOS, thanks to a GeForce Now game streaming loophole",
106,NVDA,2022-01-13T06:55:39Z,Apple Supplier TSMC's Q4 Profit Jumps 16.4% Amid Higher Chip Demand,"Apple Inc (NASDAQ: AAPL) supplier and the world’s largest chipmaker Taiwan Semiconductor Manufacturing Co Ltd (NYSE: TSM) said on Thursday its fourth-quarter profit jumped 16.4% to $5.98 billion, helped by rising dem"
107,NVDA,2022-01-12T19:44:07Z,Watching Chip Stocks; Traders Circulate Rumors Microsoft Hires Apple Engineer To Design Own Server Chips,
108,NVDA,2022-01-12T17:36:38Z,10 Information Technology Stocks Whale Activity In Today's Session,"This whale alert can help traders discover the next big trading opportunities.
Whales are entities with large sums of money and we track their transactions here at Benzinga on our options activity scanner."
109,NVDA,2022-01-12T16:53:29Z,"Top 10 WallStreetBets Mentions for January 12, 2022 Since 9:30 AM Open: TSLA, GME, LCID, BABA, TSM, NVDA, HOOD, MSFT, TELL, AMC",
110,NVDA,2022-01-12T15:47:36Z,EXCLUSIVE: Unusual Whales Creates 'Nancy Pelosi ETF' So You Can Track Her Trades,Members of U.S. Congress are permitted to buy and sell stocks and options in public companies as long as they publicly disclose their trades. The rule has come under scrutiny recently and became one of the focuses of the online platform Unusual Whales.
111,NVDA,2022-01-12T15:18:13Z,"Intel, NVIDIA Shares Quiet Following Wccftech Report 'Intel's Chipmaking Plans Threaten Arm Says NVIDIA As It Argues Deal Is Crucial For Arm's Survival'",
112,NVDA,2022-01-12T15:14:14Z,"This EV Stock Has A Better 6-Month Return Than Tesla, Ford, Nvidia And Apple","Lucid Group Inc (NASDAQ: LCID) aims to create sustainable mobility without compromise, and recent traders and investors in the luxury EV-maker have been rewarded handsomely."
113,NVDA,2022-01-11T17:35:52Z,10 Information Technology Stocks With Whale Alerts In Today's Session,"This whale alert can help traders discover the next big trading opportunities.
Whales are entities with large sums of money and we track their transactions here at Benzinga on our options activity scanner."
114,NVDA,2022-01-11T15:26:40Z,Check Out What Whales Are Doing With NVDA,"A whale with a lot of money to spend has taken a noticeably bullish stance on NVIDIA.
Looking at options history for NVIDIA (NASDAQ:NVDA) we detected 18 strange trades."
115,NVDA,2022-01-11T14:08:50Z,'Nvidia announces new RTX 3080 with 12GB of memory' -The Verge Report,
