,ticker,timestamp,headline,summary
1167,NVDA,2021-01-21T21:30:02Z,Intel Reports Q4 Earnings Beat,"Intel Corporation (NASDAQ: INTC) surged ahead of Thursday&#39;s market close, as its fourth-quarter earnings report hit the wire earlier than expected."
1168,NVDA,2021-01-21T20:52:36Z,"AMD, NVIDIA Shares At New Session Highs Following Report Of Intel Q4 Earnings Leak Showing Beat, Strong FY21 Guidance",
1169,NVDA,2021-01-21T14:41:26Z,"Jim Cramer Discusses Procter & Gamble, Intel And Cautions On SPACs","Jim Cramer shared his first thoughts on the market Thursday discussing recent earnings and the large number of SPACs.

On Procter and Gamble: The recent earnings report from Procter &amp; Gamble Co (NYSE: PG) is being undervalued by investors, Cramer said."
1170,NVDA,2021-01-19T14:38:46Z,This Week Will Be About More Than Inauguration Day Alone,"Since 2020 March lows, the market saw a nothing short of extraordinary record-shattering rally. But how much higher can it go as COVID continues to rage across the US and Europe? That answer will become a bit clearer as traders have returned from the long holiday weekend and equity markets have reopened."
1171,NVDA,2021-01-16T17:04:39Z,"Benzinga's Weekly Bulls And Bears: AMD, Marathon, Tesla, Uber, Walgreens And More","
	Benzinga has examined the prospects for many investor favorite stocks over the past week. 
	The week&#39;s bullish calls included the electric vehicle leader and a recovering retailer.
	A ride-sharing company and a semiconductor maker were among the bearish calls.
"
1172,NVDA,2021-01-15T17:34:56Z,Understanding NVIDIA's Unusual Options Activity," 

 

On Friday, shares of NVIDIA (NASDAQ:NVDA) saw unusual options activity. After the option alert, the stock price moved down to $519.96."
1173,NVDA,2021-01-15T17:24:43Z,"Truist Securities Maintains Buy on NVIDIA, Raises Price Target to $672",
1174,NVDA,2021-01-15T17:23:29Z,"Susquehanna Maintains Positive on NVIDIA, Raises Price Target to $625",
1175,NVDA,2021-01-14T18:00:52Z,Nvidia's Comprehensive Involvement In Gaming Market Continues Strong Demand: Rosenblatt,"NVIDIA Corporation (NASDAQ: NVDA) is a dominant player in the gaming GPU market, and its competitive position is only going to get better, according to an analyst at Rosenblatt Securities."
1176,NVDA,2021-01-14T17:00:47Z,"4 Intel Analysts On What New CEO Means For Chipmaker's Market Share, Turnaround","Intel Corporation (NASDAQ: INTC)  announced a new CEO Wednesday, sending the chipmaker&#39;s shares higher by about 7%."
1177,NVDA,2021-01-14T08:07:06Z,Why Cramer Sees Intel Shakeup As A Buy Opportunity In Rival Chipmaker,"The change of leadership at Intel Corporation (NASDAQ: INTC) presents an opportunity to purchase shares of rival chipmaker Advanced Micro Devices, Inc (NASDAQ: AMD), "
1178,NVDA,2021-01-14T05:13:16Z,Alibaba Launches Electric Sedan In Partnership With China's Largest Automaker: What You Need To Know,"Alibaba Group Holding Ltd (NYSE: BABA) launched an electric sedan with state-owned SAIC Motor, China’s largest car company, Nikkei Asia reported Thur"
1179,NVDA,2021-01-13T22:40:58Z,"Sony Tests New Features, Looks At Possible Partners For Electric Vehicle At CES",One of the big items unveiled at Consumer Electronics Show (CES) 2021 was an electric vehicle concept from Sony Corp (NYSE: SNE). The company took the opportunity at the virtual CES 2021 to show off more details and videos about testing the car.
1180,NVDA,2021-01-13T15:52:29Z,'CES has blessed us with a three-webcam laptop' -Engadget,
1181,NVDA,2021-01-12T22:06:22Z,Will Micron Stock Reach $200 By 2022?,"Every week, Benzinga conducts a sentiment survey to find out what traders are most excited about, interested in or thinking about as they manage and build their personal portfolios."
1182,NVDA,2021-01-12T16:23:25Z,The Chinese EV Invasion,"When it comes to EVs, all eyes are on Tesla Inc&#39;s (NASDAQ: TSLA) whose fortunes have made it the highest-valued car company in the world, and now its CEO, Elon Musk, the richest man in the world, overtaking Amazon.com, Inc.&#39;s (NASDAQ: "
1183,NVDA,2021-01-12T04:10:58Z,"Applied Materials, II-VI Are BofA's Favorite Semiconductor Plays For 2021","Tech stocks are poised to outperform yet again as the industry sees accelerating growth, according to an analyst at BofA Securities."
1184,NVDA,2021-01-11T17:42:27Z,10 Information Technology Stocks With Unusual Options Alerts In Today's Session,This unusual options alert can help traders discover the next big trading opportunities. Traders will search for circumstances when the market estimation of an option diverges heavily from its normal worth. Unusual trading activity could push option prices to exaggerated or underestimated levels.
1185,NVDA,2021-01-11T15:40:41Z,Why NVIDIA Is Trading Higher Today,"The Price And Volume Action In NVIDIA&#39;s Stock Today

NVIDIA&#39;s (NASDAQ:NVDA) stock has been rising Monday, up 4.21% to a price of $552.8. Monday the stock has been traded at a volume of 4.67 million, about 68.56% of its recent 30-day volume average of 6.81 million."
1186,NVDA,2021-01-11T14:51:43Z,Price Over Earnings Overview: NVIDIA, 
1187,NVDA,2021-01-09T18:32:33Z,NIO Announced Partnership with NVIDIA to Develop a New Generation of Automated Driving EV's,
1188,NVDA,2021-01-09T15:35:41Z,"Nio Day 2020: EV Maker Shows Off ET7 Sedan, New Power Swap Station, 150kWh Battery Pack, ADaaS and More","The Nio ET7 sedan. 

Nio Inc – ADR (NYSE: NIO) kicked off its Nio Day 2020 event in Chengdu late Saturday local time amid much fanfare. The event was attended by scores of users and Nio fans from across China, and was also livestreamed."
1189,NVDA,2021-01-07T15:23:53Z,Looking Into NVIDIA's Return On Capital Employed,"Looking at Q3, NVIDIA (NASDAQ:NVDA) earned $1.40 billion, a 114.75% increase from the preceding quarter. NVIDIA also posted a total of $4.73 billion in sales, a 22.25% increase since Q2. In Q2, NVIDIA earned $651.00 million, and total sales reached $3.87 billion."
1190,NVDA,2021-01-06T15:32:21Z,Why NVIDIA's Stock is Trading Lower Today,"The Price And Volume Action In NVIDIA&#39;s Stock Today

NVIDIA (NASDAQ:NVDA) is currently down 2.62% to a price of $521.72. Wednesday the stock has been traded at a volume of 2.86 million, about 45.39% of its recent 30-day volume average of 6.31 million."
1191,NVDA,2021-01-06T13:02:13Z,CMA To Investigate NVIDIA's Takeover Of Arm; Says Inviting Interested Third Parties To Provide Initial Views On Anticipated Acquisition,
1192,NVDA,2021-01-04T18:05:52Z,PreMarket Prep Stock Of The Day: Nvidia,"Benzinga&#39;s PreMarket Prep airs every morning from 8-9 a.m. ET. During that fast-paced, highly informative hour, traders and investors tune in to get the major news of the day, the catalysts behind those moves and the corresponding price action for the upcoming session."
1193,NVDA,2021-01-04T17:38:02Z,10 Information Technology Stocks With Unusual Options Alerts In Today's Session,This unusual options alert can help traders track potentially big trading opportunities. Traders often look for circumstances when the market estimation of an option diverges away from its normal worth. Unusual trading activity could push option prices to hyperbolic or underperforming levels.
1194,NVDA,2021-01-04T15:35:13Z,Understanding NVIDIA's Unusual Options Activity,"Shares of NVIDIA (NASDAQ: NVDA) saw some unusual options activity on Monday. Following the unusual option alert, the stock price moved up to $540.24."
1195,NVDA,2020-12-31T19:44:59Z,"Benzinga's 2020 Year In Review: Coronavirus Mayhem, Historic Crash And Recovery, EV Surge And More",2020 was a year unlike any other. The stock market suffered a historic crash as the COVID-19 pandemic spread to the United States.
1196,NVDA,2020-12-31T18:37:41Z,10 Best Performing S&P 500 Stocks Of 2020,"The S&amp;P 500 delivered one of its surprising years in recent history in 2020, gaining more than 15%. Most U.S. investors had a lot of winners in their portfolios this year, but some stocks certainly performed better than others.

Here’s a look at the 10 best-performing stocks in the entire S&amp;P 500 in 2019 as of the Dec. 29 closing price."
1197,NVDA,2020-12-30T15:34:29Z,ROCE Insights For NVIDIA,"Looking at Q3, NVIDIA (NASDAQ: NVDA) earned $1.40 billion, a 114.75% increase from the preceding quarter. NVIDIA also posted a total of $4.73 billion in sales, a 22.25% increase since Q2. In Q2, NVIDIA earned $651.00 million, and total sales reached $3.87 billion."
1198,NVDA,2020-12-29T17:11:25Z,Will Nvidia Or Micron Stock Grow More By 2022?,"Every week, Benzinga conducts a sentiment survey to find out what traders are most excited about, interested in or thinking about as they manage and build their personal portfolios."
1199,NVDA,2020-12-28T21:12:50Z,Mizuho's Top Semiconductor Stocks For 2021: Do You Own Them?,"The new year is shaping up to be a strong one for semiconductor stocks, an analyst at Mizuho Securities said, citing key trends.

First-Half Momentum For Semiconductors:  Semiconductor companies are poised to see a constructive first half, with accelerating year-over-year momentum and favorable macroeconomic tailwinds, Mizuho analyst Vijay Rakesh said in a note."
1200,NVDA,2020-12-28T13:06:23Z,IPValue Management Licenses Patent Portfolio to NVIDIA,
1201,NVDA,2020-12-23T17:43:17Z,10 Information Technology Stocks Showing Unusual Options Activity In Today's Session,"This unusual options alert can help traders track potentially big trading opportunities. Traders often look for circumstances when the market estimation of an option diverges away from its normal worth. Unusual trading activity could push option prices to hyperbolic or underperforming levels.

Here&#39;s the list of some unusual options activity happening in today&#39;s session:"
1202,NVDA,2020-12-18T21:13:20Z,Chip Stocks Fall On Report Microsoft Will Take Things In House,"Microsoft Corp (NASDAQ: MSFT) is designing in-house processors for server computers running on the company’s cloud services, a development which will reduce reliance on Intel Corporation’s (NASDAQ: INTC"
1203,NVDA,2020-12-18T20:32:06Z,Shares Of Semiconductor/Chip Companies Dip Following Bloomberg Report Suggesting Microsoft Is Designing Its Own Chips,
1204,NVDA,2020-12-18T15:32:41Z,Understanding NVIDIA's Unusual Options Activity,NVIDIA (NASDAQ: NVDA) shares experienced unusual options activity on Friday. The stock price moved down to $531.34 following the option alert.
1205,NVDA,2020-12-18T13:20:36Z,Todd Gordon's Nvidia Option Trade,"On CNBC&#39;s &#34;Trading Nation,&#34; Todd Gordon suggested a bullish options trade in NVIDIA Corporation (NASDAQ: NVDA)."
1206,NVDA,2020-12-17T22:26:14Z,12 Emerging Technologies To Watch In 2021,"Technology stocks have historically led market rallies, and this year has been no exception. The Technology Select Sector SPDR Fund (NYSE: XLK) has advanced about 40% year-to-date, with stocks levered to remote work and study making strong upward moves."
1207,NVDA,2020-12-17T17:38:19Z,10 Information Technology Stocks Showing Unusual Options Activity In Today's Session,This unusual options alert can help traders discover the next big trading opportunities. Traders will search for circumstances when the market estimation of an option diverges heavily from its normal worth. Unusual trading activity could push option prices to exaggerated or underestimated levels.
1208,NVDA,2020-12-16T17:18:15Z,Stephanie Link On CNBC's Halftime Report Says Sold Nvidia,
1209,NVDA,2020-12-16T17:17:44Z,"Jim Cramer On CNBC's Halftime Report Says Banks Won't Be Included In His Predicted 'Boom,' Says Texas Instruments, NVIDIA",
1210,NVDA,2020-12-15T17:46:08Z,10 Information Technology Stocks Showing Unusual Options Activity In Today's Session,This unusual options alert can help traders track potentially big trading opportunities. Traders often look for circumstances when the market estimation of an option diverges away from its normal worth. Unusual trading activity could push option prices to hyperbolic or underperforming levels.
1211,NVDA,2020-12-14T17:32:31Z,"Steam Data Suggests Nvidia, AMD On Track For Big Q4","Advanced Micro Devices, Inc."
1212,NVDA,2020-12-13T20:34:28Z,"Cramer Weighs In On United Airlines, NVIDIA, JD, Fastly And More","On CNBC&#39;s &#34;Mad Money Lightning Round,&#34; Jim Cramer said he would hold onto Tortoise Energy Infrastructure Corp. (NYSE: TYG), while cautioning that he doesn&#39;t know what is in it because i"
1213,NVDA,2020-12-13T16:50:55Z,New ETF From Adasina Social Capital Gets To Heart Of Social Justice Investing,"Investing with a conscience is moving beyond environmental friendliness and sustainability. These days, social justice is an increasingly prominent part of the equation."
1214,NVDA,2020-12-12T18:46:42Z,"Notable Insider Buys Of the Past Week: Avis Budget, Biotech IPOs And More","
	Insider buying can be an encouraging signal for potential investors when markets face uncertainty.
	This past week, some insiders took advantage of biotech initial public offerings.
	Some insiders were making return trips to the buy window to increase their stakes.


"
1215,NVDA,2020-12-09T15:47:14Z,7 Stocks That Could Benefit From China's 'Urban Air Mobility' Investment,China recently announced it plans to invest in the development and promotion of Urban Air Mobility.
1216,NVDA,2020-12-07T16:41:00Z,Nvidia Hosts Conference Call Webcast (Live Stream Link),
1217,NVDA,2020-12-07T16:40:14Z,Nvidia CFO Says Expect Overall A100 GPU To Gain Further Adoption In Data Center Segment,
1218,NVDA,2020-12-07T08:01:35Z,"The Street Price PlayStation 5, Xbox Series X Are Really Selling At, As Per The Verge","PlayStation 5 and the latest Xbox consoles are fetching a premium on resale on eBay Inc (NASDAQ: EBAY), in excess of double their retail price, "
1219,NVDA,2020-12-03T15:08:45Z,3 Tech Stocks To Keep On Your Holiday Radar,"Since the market plunged in March, tech companies recovered quickly and the tech index rose 70%. They have the pandemic to thank for that as it gave them ‘Pixie dust&#34; kind of fuel to reach new heights."
1220,NVDA,2020-12-02T21:36:25Z,Why Sony's PlayStation 5 Is Winning What Could Be The Last Console War,The year has seen strength in gaming stocks due to more gamers during the COVID-19 pandemic.
1221,NVDA,2020-12-02T17:28:20Z,"Cramer On CNBC's Halftime Report Highlights Nvidia-Arm Deal, Says He's Long Co",
1222,NVDA,2020-12-02T15:52:38Z,3 Sports Stocks That Are Winning The Game,"Even with the sports calendar disrupted because of the pandemic, there are several companies with exposure to the industry that are quickly becoming Wall Street favorites."
1223,NVDA,2020-12-01T17:36:47Z,"Josh Brown On CNBC's Halftime Report Says It's Important To Focus On Analyst Expectations, But It's Not The Only Catalyst, Says That's Why He Likes Nvidia",
1224,NVDA,2020-12-01T17:16:44Z,Will AMD Or Nvidia Stock Grow More By 2025?,"Every week, Benzinga conducts a sentiment survey to find out what traders are most excited about, interested in or thinking about as they manage and build their personal portfolios."
1225,NVDA,2020-11-25T07:50:47Z,Google Thinking Of 2023 With Its Gaming Service Stadia As War With Fellow Tech Giants Heats Up,"Alphabet Inc (NASDAQ: GOOGL) (NASDAQ: GOOG) subsidiary Google’s Director of Games Jack Buser said that the tech giant has 400 games under development for its Stadia service, The Verge "
1226,NVDA,2020-11-24T15:16:59Z,"'NVIDIA GeForce RTX 3000 Mobility Series Lineup, Roadmap 1H 2021 And AMD CPU Support!' -WCCFTech Report",
1227,NVDA,2020-11-20T17:41:55Z,10 Information Technology Stocks With Unusual Options Alerts In Today's Session,"This unusual options alert can help traders track potentially big trading opportunities. Traders often look for circumstances when the market estimation of an option diverges away from its normal worth. Unusual trading activity could push option prices to hyperbolic or underperforming levels.

Here&#39;s the list of some unusual options activity happening in today&#39;s session:"
1228,NVDA,2020-11-19T20:03:42Z,"Stocktwits Trending Stocks For Thursday, Nov. 19, 2020: GME, NKLA, AYRO, HPR, SBE, NVDA, TTCF, VXRT, GM, GMHI",
1229,NVDA,2020-11-19T19:56:43Z,"Yahoo Finance Trending Stocks For Thursday, Nov. 19, 2020: SONO, ROKU, ZBRA, SBE, NVDA, YY, COTY, BILI, BLNK, XPEV, AMD, AYRO, SOLO, SQ, CIIC, BABA, TDOC, TLS, FENG, SHOP, WPX, TWLO, LPX, CSIQ, GEVO, TTNP, NNDM, SNAP, FMCKM, MDGS",
1230,NVDA,2020-11-19T19:15:56Z,"Nvidia Analysts Upbeat Following 'Impressive' Q3 Results, Shrug Off Looming Data Center Softness",Nvidia Corporation (NASDAQ: NVDA) reported strong quarterly results and issued above-consensus guidance for the fiscal fourth quarter.
1231,NVDA,2020-11-19T18:13:05Z,"'Halftime Report' Final Trades Of The Day: CVS, Nvidia And More","On CNBC&#39;s &#34;Fast Money Halftime Report,&#34; the traders gave their final trades of the day."
1232,NVDA,2020-11-19T18:01:22Z,"Final Trades On CNBC: Josh Brown Buys NVIDIA, Kourtney Gibson Buys Toll Brothers, Jon Najarian Buys WPX Energy, Jim Lebenthal Buys CVS",
1233,NVDA,2020-11-19T15:27:21Z,"B of A Securities Maintains Buy on NVIDIA, Raises Price Target to $665",
1234,NVDA,2020-11-19T14:55:47Z,ROCE Insights For NVIDIA,"Looking at Q3, NVIDIA (NASDAQ: NVDA) earned $1.40 billion, a 114.75% increase from the preceding quarter. NVIDIA also posted a total of $4.73 billion in sales, a 22.25% increase since Q2. In Q2, NVIDIA earned $651.00 million, and total sales reached $3.87 billion."
1235,NVDA,2020-11-19T14:47:02Z,Jim Cramer On Nvidia: So Much Demand They Can't Make Enough Chips,CNBC&#39;s Jim Cramer shared his thoughts on Nvidia Corporation (NASDAQ: NVDA) after the company reported third-quarter earnings.
1236,NVDA,2020-11-19T14:20:58Z,"Mad Money Host Jim Cramer On CNBC: If NVIDIA Opens Down, You Can Still Buy It, There's A Reason Why They Missed On Some Product Lines - They Can't Keep Up With Demand",
1237,NVDA,2020-11-19T13:23:42Z,10 Biggest Price Target Changes For Thursday,"
	Wedbush raised the price target on  Uber Technologies Inc (NYSE: UBER) from $49 to $60. Uber shares fell 0.2% to $49.00 in pre-market trading.
"
1238,NVDA,2020-11-19T12:42:23Z,"Mizuho Maintains Buy on NVIDIA, Raises Price Target to $605",
1239,NVDA,2020-11-19T12:19:41Z,"Raymond James Maintains Outperform on NVIDIA, Raises Price Target to $600",
1240,NVDA,2020-11-19T11:59:07Z,"Rosenblatt Maintains Buy on NVIDIA, Raises Price Target to $650",
1241,NVDA,2020-11-19T11:06:05Z,"A Peek Into The Markets: US Stock Futures Down Ahead Of Earnings, Jobless Claims Data",Pre-open movers
1242,NVDA,2020-11-19T09:52:03Z,"5 Stocks To Watch For November 19, 2020",Some of the stocks that may grab investor focus today are:
1243,NVDA,2020-11-18T21:33:43Z,Nvidia Reports Q3 Earnings Beat,"Nvidia Corporation (NASDAQ: NVDA) reported third-quarter earnings of $2.91 per share on Wednesday, which beat the analyst consensus estimate of $2.57 by 13.23%. This is a 63.48% increase over earnings of $1.78 per share from the same period last year."
1244,NVDA,2020-11-18T21:21:05Z,NVIDIA Sees Q4 Sales $4.80B +/-2% vs $4.42B Est.,
1245,NVDA,2020-11-18T21:20:22Z,"NVIDIA Q3 Adj. EPS $2.91 Beats $2.57 Estimate, Sales $4.73B Beat $4.41B Estimate",
1246,NVDA,2020-11-18T20:33:51Z,How To Trade Nvidia Earnings Via Options,"The Set-Up

Nvidia (NASDAQ: NVDA) reports earnings after the close. The options market is pricing in about a 5% move between now and Friday&#39;s close (via Options AI):

"
1247,NVDA,2020-11-18T18:11:59Z,"Notable Earnings Watchlist For Wednesday, Nov. 18, 2020 After Market Close: NUAN, NVDA, LB, CPA, CAAP, BILI, CUB, JACK",
1248,NVDA,2020-11-18T17:59:56Z,"Jim Cramer On CNBC: Wait For The Call, Then Buy NVIDIA",
1249,NVDA,2020-11-18T17:56:41Z,10 Information Technology Stocks With Unusual Options Alerts In Today's Session,This unusual options alert can help traders discover the next big trading opportunities. Traders will search for circumstances when the market estimation of an option diverges heavily from its normal worth. Unusual trading activity could push option prices to exaggerated or underestimated levels.
1250,NVDA,2020-11-18T14:48:14Z,Price Over Earnings Overview: NVIDIA," 

"
1251,NVDA,2020-11-18T14:00:16Z,Mike Khouw Sees Unusual Options Activity In Nvidia,"On CNBC&#39;s &#34;Options Action,&#34; Mike Khouw said calls outpaced puts in Nvidia Corporation (NASDAQ: NVDA) on Tuesday."
1252,NVDA,2020-11-18T11:08:36Z,"A Peek Into The Markets: US Stock Futures Up; Target, NVIDIA Earnings In Focus",Pre-open movers
1253,NVDA,2020-11-18T09:48:36Z,"5 Stocks To Watch For November 18, 2020",Some of the stocks that may grab investor focus today are:
1254,NVDA,2020-11-18T09:05:38Z,"Earnings Scheduled For November 18, 2020"," 

Companies Reporting Before The Bell

• Grupo Aval Acciones (NYSE:AVAL) is estimated to report quarterly earnings at $0.09 per share on revenue of $1.46 billion."
1255,NVDA,2020-11-17T15:11:35Z,Earnings Outlook For NVIDIA,"On Wednesday, November 18, NVIDIA (NASDAQ: NVDA) will report its last quarter&#39;s earnings. Here is Benzinga&#39;s preview of the company&#39;s release."
1256,NVDA,2020-11-17T13:17:05Z,"SMART Global Holdings Unit Penguin Computing Announces TrueHPC With NVIDIA, CloudBase Solution With Intel",
1257,NVDA,2020-11-16T17:49:35Z,"Brenda Vingiello On CNBC: I Own NVIDIA, But I Think The Bar Is Especially High For This Quarter, Looking To See How ARM Acquisition Affects Growth Going Forward",
1258,NVDA,2020-11-16T14:05:00Z,NVIDIA Announces A100 80GB GPU,
1259,NVDA,2020-11-16T13:40:09Z,"Benzinga Pro's Top 5 Stocks To Watch For Monday, Nov. 16, 2020: MRNA, WMT, MYL, NVDA, IMMR",
1260,NVDA,2020-11-14T20:07:07Z,"Barron's Picks And Pans: Alibaba, Intel, Target, Visa And More","
	This weekend&#39;s Barron&#39;s cover offers a low-risk strategy for investors optimistic about an ecomomic recovery.
	Other featured articles discuss what a COVID-19 vaccine would mean for the stock market and how it could shake up the pharmaceutical industry.
"
1261,NVDA,2020-11-13T17:36:46Z,"Stephanie Link On CNBC: If NVIDIA Pulled Back 15%-25%, I Might Add To It",
1262,NVDA,2020-11-12T20:05:20Z,5 Top Semiconductor Stocks As Post-Election Plays,"The dust is settling down after the long-drawn U.S. presidential election, and at this juncture, BofA Securities sees a handful of semiconductor stocks as post-election plays that present attractive buying opportunities."
1263,NVDA,2020-11-12T19:46:47Z,NVIDA Shares Fall ~1% Following Report Amazon Will Move Some Alexa Computing To Its Own Chips,
1264,NVDA,2020-11-12T19:41:48Z,Amazon to Move a Majority Of Alexa Computing To Its Own Chips,
1265,NVDA,2020-11-12T14:59:19Z,Cramer Shares His Thoughts On Nvidia,"On CNBC&#39;s &#34;Squawk on the Street,&#34; Jim Cramer shared his thoughts on the popular chipmaker Nvidia Corporation (NASDAQ: NVDA).

&#34;All Nvidia does is shoot the lights out,&#34; said Cramer. He went on to say it raises expectations too high."
1266,NVDA,2020-11-12T14:33:30Z,"Cramer On CNBC: NVIDIA, If They Get ARM, Will Be What We Used To Think Of Intel As",
1267,NVDA,2020-11-12T14:32:16Z,"Cramer On CNBC: 'All NVIDIA Does Is Shoot The Lights Out,' But It Raises Expectations Too High",
1268,NVDA,2020-11-11T20:55:10Z,Bitcoin Bull Mark Yusko Calls The Cyptocurrency 'An Asset Most People Don't Understand',"Mark Yusko, CEO and CIO of Morgan Creek Capital Management and Morgan Creek Digital, and notorious bitcoin bull discussed his outlook for cryptocurrencies during an appearance on Benzinga’s PreMarket Prep show this week."
1269,NVDA,2020-11-11T20:25:34Z,Real Estate Refreshed With A New ETF,"The real estate sector is evolving, but the same isn&#39;t true of many of the traditional exchange-traded funds tracking the group.

What Happened: A small number of ETFs offer investors more modern approaches to the real estate sector, including the newly minted Global X Data Center REITs &amp; Digital Infrastructure ETF (NASDAQ:VPN)."
1270,NVDA,2020-11-11T17:50:16Z,"'Halftime Report' Traders On Nvidia, Amazon","Decatur Capital Management Principal&#39;s Degas Wright and Hightower Advisors&#39; Stephanie Link on CNBC&#39;s &#34;Halftime Report&#34; gave their thoughts on Nvidia Corporation (NASDAQ: NVDA) and Amazon.com, Inc. (NASDAQ: "
1271,NVDA,2020-11-11T17:36:58Z,Decatur Capital Management Principal Degas Wright On CNBC: NVIDIA Has Expanded Their Reach Across More Platforms And A Bigger User Base; Hold It For The Long-Term,
1272,NVDA,2020-11-11T15:02:46Z,Looking Into NVIDIA's Return On Capital Employed,"NVIDIA (NASDAQ: NVDA) showed a loss in earnings since Q1, totaling $651.00 million. Sales, on the other hand, increased by 25.52% to $3.87 billion during Q2. NVIDIA reached earnings of $976.00 million and sales of $3.08 billion in Q1."
1273,NVDA,2020-11-11T08:11:32Z,Apple's Theft Claim Against 'Fortnite' Maker Epic Gets Thrown Out By Court,Apple Inc’s (NASDAQ: AAPL) two tort claims against game developer Epic Games Inc have been dismissed by a U.S.
1274,NVDA,2020-11-10T19:20:24Z,Why Corsair Could Be The Best Way To Play Booming Gaming Market,"The video game sector has produced several winners in 2020. Recent IPO Corsair Gaming (NASDAQ: CRSR) reported its third-quarter earnings, which saw growth from the industry and products selling out as soon as they hit shelves. The company makes gaming-related gear and technology."
1275,NVDA,2020-11-10T09:49:58Z,"Tesla To Refund Older Model S, X Owners For MCU Failures: CNBC","Tesla Inc (NASDAQ: TSLA) will refund owners of older Model S and X electric vehicles for out-of-pocket repair costs paid by them for main computer failure, "
1276,NVDA,2020-11-09T22:03:03Z,"NVIDIA Shares Quiet After Hours Following Co. Press Release Disclosing Hyundai Motor Has Selected Co.'s DRIVE Infotainment, AI Platform For All Future Hyundai, Kia, Genesis Models",
