,ticker,timestamp,headline,summary
127,TSP,2021-05-10T10:40:21Z,"RBC Capital Initiates Coverage On TuSimple Hldgs with Outperform Rating, Announces Price Target of $52",
128,TSP,2021-05-10T10:03:11Z,A Peek Into The Markets: US Stock Futures Mixed; Crude Oil Edges Higher,Pre-open movers
129,TSP,2021-05-10T09:45:35Z,"Needham Initiates Coverage On TuSimple Hldgs with Buy Rating, Announces Price Target of $60",
130,TSP,2021-05-10T01:49:50Z,Cathie Wood Loads Up Another $28M Worth Of Shares In Alibaba Rival JD.Com,"Cathie Wood-led Ark Investment Management on Friday bought 366,879 shares, worth about $27.7 million, in JD.com Inc (NASDAQ: JD), a key rival to Alibaba Group Holding (NYSE: BABA) in the e-commerce space in China."
131,TSP,2021-04-28T02:34:05Z,Cathie Wood Sells $35.7M More Worth Of Square Stock And Loads Up $25.8 M In Coinbase,"Cathie Wood-led Ark Investment Management on Tuesday sold another 140,682 shares of the payments company Square Inc (NYSE: SQ), estimated to be worth $35.7 million as of Tuesday&#39;s close, as it looks to rebalance its portfolio."
132,TSP,2021-04-27T07:15:14Z,"Cathie Wood Adds $33.8M Shares In Shopify, Sells More Square To Pile Up Coinbase","Cathie Wood-led Ark Investment Management on Monday snapped up 28,989 shares of the Canadian e-commerce company Shopify Inc (NYSE: SHOP), worth about $33.8 million, as the stock jumped ahead of its scheduled earnings report later this week."
133,TSP,2021-04-25T12:30:15Z,"Last Week's Notable Insider Buys: AppLovin, Bed Bath And Beyond, TuSimple And More","
	Insider buying can be an encouraging signal for potential investors, especially when markets are near all-time highs.
	Once again, some insiders took advantage of recent public share offerings to add or bolster stakes.
"
134,TSP,2021-04-21T07:29:15Z,"Cathie Wood Loads Up On DraftKings, Coinbase, Palantir, Sells Nvidia, Square","Cathie Wood-led Ark Investment Management on Tuesday snapped up another 236,348 shares of cryptocurrency exchange Coinbase Global Inc (NASDAQ: COIN)."
135,TSP,2021-04-21T01:56:01Z,"Cathie Wood's ARK Invest Posts Fund Purchases For Tuesday, Apr. 20, 2021: JD, OPEN, PDD, RXRX, IONS, PLTR, DKNG, COIN, BLI, BEAM, TSP, WKHS, SPFR, NIU, IRDM, DDD, TCEHY, RBLX, PTON, OKTA, RTP",
136,TSP,2021-04-20T05:48:23Z,"Cathie Wood Buys Peloton, Coinbase Dips, Cuts Nvidia Stake",Cathie Wood-led Ark Investment Management on Monday snapped up shares of the exercise bike maker Peloton Interactive Inc (NASDAQ: PTON) amid weakness related to a U.S.
137,TSP,2021-04-20T02:09:28Z,"Cathie Wood's ARK Invest Posts Fund Purchases For Monday, Apr. 19, 2021: COIN, JD, OPEN, PDD, BLI, CMLF, MASS, RXRX, BEAM, EXAS, TSP, WKHS, U, SPFR, NNDM, NIU, DDD, PTON, RTP, NFLX",
138,TSP,2021-04-18T12:56:49Z,"Exclusive: TuSimple CEO On Autonomous Semitrucks, Competition And Going Public",Autonomous trucking startup TuSimple Holdings Inc (NASDAQ: TSP) held its IPO on Thursday. Company CEO Cheng Lu joined Benzinga’s “Premarketprep At The Close” for an interview to discuss the company and its market debut.
139,TSP,2021-04-16T11:45:56Z,TuSimple Paints Optimistic Profit Projections For 2024 Driverless Truck Launch: Bloomberg,"
"
140,TSP,2021-04-16T06:59:29Z,Cathie Wood Cuts Square Stake And Snaps Up More Coinbase On Day Two,"Cathie Wood-led Ark Investment Management on Thursday snapped up another 3,41,186 shares, worth about $110 million, of the biggest U.S. cryptocurrency exchange desk Coinbase Global Inc (NASDAQ: COIN), on the second day of trading after its debut on NASDAQ through a direct listing."
141,TSP,2021-04-16T03:51:43Z,"Cathie Wood's ARK Invest Posts Fund Purchases For Thursday, Apr. 15, 2021: COIN, MASS, BEAM, EXAS, U, TSP, IRDM, SPCE",
142,TSP,2021-04-15T15:52:48Z,TuSimple Shares Open For Trade At $40.25; IPO Priced At $40/Share,
143,TSP,2021-04-15T15:12:33Z,TuSimple Holdings Indicating $40 On 1.5M Shares,
144,TSP,2021-04-13T14:28:03Z,The IPO Week Ahead,"This week, five IPOs are scheduled to raise $4.5 billion in the week ahead, led by the largest U.S. cryptocurrency exchange Coinbase&#39;s (NASDAQ: COIN) widely anticipated direct listing."
145,TSP,2021-04-12T21:22:56Z,"IPO Preview: Coinbase, AppLovin, TuSimple Highlight Big Week Of Market Debuts","The week of April 12 is shaping up to be a big one for public debuts, with many investors watching the highly anticipated direct listing of Coinbase.

Here&#39;s a look at the Coinbase IPO and other companies set to go public this week."
146,TSP,2021-04-12T14:21:29Z,Let's Take a Look At Some Upcoming IPOs This Week,So far in 2021 there have been quite a few appealing Initial Public Offerings (IPOs) available on the 
147,TSP,2015-02-10T12:33:41Z,"Molson Coors Reports Q4 GAAP EPS from Continuing Operations $0.50, Underlying After-Tax EPS $0.55 vs $0.69 Est.",
